nome,url,url_canonical,indirizzo,cap,citta,provincia,regione,paese,telefono,email,sito_web,padiglione,stand,coespositore,espositore_principale,partita_iva,marchi,categorie,descrizione
PLAST,https://dp-plast.fieramilano.it/exhibitor/1,https://dp-plast.fieramilano.it/exhibitor/1,,,,,,,,,,,,,,,,,
ALFA STAMPI,https://dp-plast.fieramilano.it/exhibitor/2,https://dp-plast.fieramilano.it/exhibitor/2,Via Guglielmo Marconi 41,24060,ADRARA SAN MARTINO,BG,Lombardia,Italy,+39 035 933237,info@alfastampi.com,http://www.alfastampi.com,11,B15,,,,,"STAMPI, ALTRI | STAMPI PER INIEZIONE/COMPRESSIONE | SEMILAVORATI, LASTRE E BLOCCHI | ALTRI SEMILAVORATI E PRODOTTI DI FINITURA | STAMPAGGIO A INIEZIONE | STAMPI E FILIERE PER  MATERIE PLASTICHE E GOMMA | MACCHINE E ATTREZZATURE PER L'INDUSTRIA DELLE MATERIE PLASTICHE E DELLA GOMMA | SEMILAVORATI E PRODOTTI DI FINITURA | FORNITORI DI SEMILAVORATI O PRODOTTI FINITI IN  MATERIE PLASTICHE E GOMMA E SERVIZI DI LAVORAZIONE C | FORNITURA DI LAVORAZIONI PER CONTO TERZI","PROGETTAZIONE, PRODUZIONE DI STAMPI PER ARTICOLI TECNICI IN GOMMA E BICOMPONENTI"
SVERITAL,https://dp-plast.fieramilano.it/exhibitor/3,https://dp-plast.fieramilano.it/exhibitor/3,Via Santa Maria 108,20093,COLOGNO MONZESE,MI,Lombardia,Italy,+39 02 251561,info@sverital.it,http://www.sverital.it,22,C121 D122,,,,,"SALDATRICI A LASER | MACCHINE E IMPIANTI PER FINITURA, DECORAZIONE, STAMPA E MARCATURA, ALTRE E LINEE DI CONFEZIONAMENTO | SISTEMI A CANALI CALDI | ATTREZZATURE PER INCISIONE / PULIZIA STAMPI E FILIERE | ATTREZZATURE DI DOSAGGIO | UNITÀ DI RISCALDAMENTO E RAFFREDDAMENTO PER STAMPI E FILIERE | SEPARATORI DI MATEROZZE | SISTEMI DI ESTRAZIONE POLVERI E FUMI | DISPOSITIVI E SISTEMI DI CONTROLLO E SUPERVISIONE, ALTRI | ATTREZZATURE AUSILIARIE PER LA LAVORAZIONE DI  MATERIE PLASTICHE E GOMMA, ALTRE | CILINDRI DI PLASTIFICAZIONE | INGEGNERIA DI PRODUZIONE | AUTOMAZIONE, ROBOTICA E INFORMATICA | SALDATRICI PER  MATERIE PLASTICHE E GOMMA | MACCHINE E ATTREZZATURE PER L'INDUSTRIA DELLE MATERIE PLASTICHE E DELLA GOMMA | MACCHINE E IMPIANTI PER FINITURA, DECORAZIONE, STAMPA E E MARCATURA DI PRODOTTI I",
PROFILE DIES,https://dp-plast.fieramilano.it/exhibitor/4,https://dp-plast.fieramilano.it/exhibitor/4,"Via delle Industrie 2, Frazione Torba",21040,GORNATE OLONA,VA,Lombardia,Italy,+39 0331 855010,info@profiledies.com,http://www.profiledies.it,13,G25 H26,,,,,"IMPIANTI D'ESTRUSIONE PER FILM-FOGLIE-LASTRE | ESTRUSORI MONOVITE | ESTRUSORI, ALTRI | IMPIANTI D'ESTRUSIONE PER TUBI E PROFILI | IMPIANTI D'ESTRUSIONE, ALTRI | ESTRUSORI E IMPIANTI D'ESTRUSIONE PER  MATERIE PLASTICHE E GOMMA | MACCHINE E ATTREZZATURE PER L'INDUSTRIA DELLE MATERIE PLASTICHE E DELLA GOMMA",
FARCON,https://dp-plast.fieramilano.it/exhibitor/5,https://dp-plast.fieramilano.it/exhibitor/5,Via Fontanella 10,22043,SOLBIATE CON CAGNO,CO,Lombardia,Italy,+39 031 806827,farcon@farcon.it,http://www.farcon.it,15,C47 C49,,,,,FILIERE D'ESTRUSIONE | POMPE PER MASSE FUSE | CAMBIAFILTRI | STAMPI E FILIERE PER  MATERIE PLASTICHE E GOMMA | MACCHINE E ATTREZZATURE PER L'INDUSTRIA DELLE MATERIE PLASTICHE E DELLA GOMMA | ATTREZZATURE AUSILIARIE PER LA LAVORAZIONE DI  MATERIE PLASTICHE E GOMMA,"Farcon Plastic Processing Machinery S.r.l. è un'officina meccanica specializzata nella progettazione, costruzione, revisione e riparazione di attrezzature ausiliarie per impianti di estrusione di materie plastiche.
 Fondata con l'obiettivo di rispondere alle esigenze di un mercato in continua evoluzione, l'azienda si impegna a offrire soluzioni su misura, combinando esperienza pluriennale, innovazione tecnologica e competenze specialistiche.
 Grazie a un team altamente qualificato e a una dotazione tecnologica all'avanguardia, siamo in grado di realizzare componenti meccanici di alta precisione e garantire elevati standard qualitativi in ogni fase della produzione."
PROVER,https://dp-plast.fieramilano.it/exhibitor/6,https://dp-plast.fieramilano.it/exhibitor/6,Via Sandro Pertini 35/B,23807,MERATE,LC,Lombardia,Italy,+39 039 9284924,info@prover.it,http://www.prover.it,24,C62 C68,,,,,"STAMPI, ALTRI | STAMPAGGIO A INIEZIONE | STAMPI E FILIERE PER  MATERIE PLASTICHE E GOMMA | MACCHINE E ATTREZZATURE PER L'INDUSTRIA DELLE MATERIE PLASTICHE E DELLA GOMMA | FORNITURA DI LAVORAZIONI PER CONTO TERZI | FORNITORI DI SEMILAVORATI O PRODOTTI FINITI IN  MATERIE PLASTICHE E GOMMA E SERVIZI DI LAVORAZIONE C","Progettazione, costruzioni stampi e stampaggio articoli in plastica e LSR"
DIAP,https://dp-plast.fieramilano.it/exhibitor/7,https://dp-plast.fieramilano.it/exhibitor/7,Via Vepre snc,60043,CERRETO D'ESI,AN,Marche,Italy,+39 0732 677213,info@diap.it,http://www.diap.it,9,B101,,,,,"COPOLIMERI DI POLIPROPILENE (PPCP) | OMOPOLIMERI DI POLIPROPILENE (PPHP) | POLIPROPILENE RIGENERATO (R PP) | MASTERBATCH RITARDANTI DI FIAMMA | POLIOLEFINICHE | MATERIE PRIME, RIGENERATE E COMPOSITI | PIGMENTI, COLORANTI E MASTERBATCH",Produttore compound e masterbatch flame retardant su base PP
C2,https://dp-plast.fieramilano.it/exhibitor/8,https://dp-plast.fieramilano.it/exhibitor/8,Via Carlo Gazzo 25,27029,VIGEVANO,PV,Lombardia,Italy,+39 0381 344813,info@c2macchinegomma.it,http://www.c2macchinegomma.it,11,C16,,,,,"MESCOLATORI A CILINDRI | ATTREZZATURE PER RIDUZIONE DIMENSIONALE (FRANTUMATORI, TRITURATORI, GRANULATORI) | IMPIANTI DI MESCOLAZIONE | ESTRUSORI MONOVITE | ESTRUSORI, ALTRI | IMPIANTI D'ESTRUSIONE PER GOMMA | PRESSE, ALTRE | PRESSE A COMPRESSIONE E TRANSFER | MACCHINE A INIEZIONE PER GOMMA | CALANDRE | MACCHINE PER LA LAVORAZIONE DELLA GOMMA, ALTRE | TAGLIERINE | ATTREZZATURE AUSILIARIE PER LA LAVORAZIONE DI  MATERIE PLASTICHE E GOMMA, ALTRE | MISCELATORI, ALTRI | MACCHINE E ATTREZZATURE PER LA PREPARAZIONE E IL RICICLAGGIO DELLE MATERIE PLASTICHE E DELLA GOMMA | MACCHINE E ATTREZZATURE PER L'INDUSTRIA DELLE MATERIE PLASTICHE E DELLA GOMMA | ESTRUSORI E IMPIANTI D'ESTRUSIONE PER  MATERIE PLASTICHE E GOMMA | PRESSE PER  MATERIE PLASTICHE E GOMMA | MACCHINE A INIEZIONE PER  MATERIE PLASTICHE","Da oltre 40 anni ci occupiamo di revisionare, personalizzare e costruire macchine nuove per la lavorazione della gomma e delle materie plastiche."
TAKIN,https://dp-plast.fieramilano.it/exhibitor/9,https://dp-plast.fieramilano.it/exhibitor/9,Corso Noblesville 17,35013,CITTADELLA,PD,Veneto,Italy,+39 049 9408532,info@takin.it,http://www.takin.it,13,N25,,,,,"ESTRUSORI, ALTRI | MACCHINE PER ESPANSI, ALTRE | CORRUGATORI PER TUBI E LASTRE | TAGLIERINE | AVVOLGITORI-BOBINATORI | MACCHINE PER TAGLIO LONGITUDINALE E PELATURA | REGGIATRICI | ESTRUSORI E IMPIANTI D'ESTRUSIONE PER  MATERIE PLASTICHE E GOMMA | MACCHINE E ATTREZZATURE PER L'INDUSTRIA DELLE MATERIE PLASTICHE E DELLA GOMMA | MACCHINE PER ESPANSI E RESINE REATTIVE O RINFORZATE | MACCHINE PER LAVORAZIONE SECONDARIA DI  MATERIE PLASTICHE E GOMMA | MACCHINE E IMPIANTI PER FINITURA, DECORAZIONE, STAMPA E E MARCATURA DI PRODOTTI IN MATERIE PLASTICHE",
CDG,https://dp-plast.fieramilano.it/exhibitor/10,https://dp-plast.fieramilano.it/exhibitor/10,Via Astico 20,36010,CARRE',VI,Veneto,Italy,+39 0445 319360,amministrazione@cdg1971.it,http://www.cdg1971.it,11,B02,,,,,MACCHINE A INIEZIONE PER GOMMA | MACCHINE A INIEZIONE MULTISTAZIONE | MACCHINE A INIEZIONE PER TERMOPLASTICI FINO A 250 KN DI FORZA DI CHIUSURA | MACCHINE A INIEZIONE PER  MATERIE PLASTICHE E GOMMA | MACCHINE E ATTREZZATURE PER L'INDUSTRIA DELLE MATERIE PLASTICHE E DELLA GOMMA,
COLOMBO,https://dp-plast.fieramilano.it/exhibitor/11,https://dp-plast.fieramilano.it/exhibitor/11,Via Carlo dell'Acqua 50,20027,RESCALDINA,MI,Lombardia,Italy,+39 0331 576022,info@colombosrl.com,http://www.colombosrl.com,15,L41 M42,,,,,"PARTI E COMPONENTI DI MACCHINE PER MATERIE PLASTICHE E GOMMA, ALTRE | FILTRI PER MASSE FUSE | PARTI E COMPONENTI DI MACCHINE  PER MATERIE PLASTICHE E GOMMA | MACCHINE E ATTREZZATURE PER L'INDUSTRIA DELLE MATERIE PLASTICHE E DELLA GOMMA",
BRUNO FOLCIERI,https://dp-plast.fieramilano.it/exhibitor/12,https://dp-plast.fieramilano.it/exhibitor/12,Via Sopracomune 1,26030,VOLONGO,CR,Lombardia,Italy,+39 0372 845921,info@folcieri.com,http://www.brunofolcieri.it,15,N41 P42,,,,,"ATTREZZATURE PER RIDUZIONE DIMENSIONALE (FRANTUMATORI, TRITURATORI, GRANULATORI) | IMPIANTI DI RICICLAGGIO | MACCHINE E ATTREZZATURE PER LA PREPARAZIONE E IL RICICLAGGIO DELLE MATERIE PLASTICHE E DELLA GOMMA | MACCHINE E ATTREZZATURE PER L'INDUSTRIA DELLE MATERIE PLASTICHE E DELLA GOMMA",
GFB GROUP,https://dp-plast.fieramilano.it/exhibitor/13,https://dp-plast.fieramilano.it/exhibitor/13,Via Botticelli 1,20022,CASTANO PRIMO,MI,Lombardia,Italy,+39 0331 883734,info@gfbgroup.it,http://www.gfbgroup.it,13,A13 A15,,,,,"MACCHINE PER ESTRUSIONE/SOFFIAGGIO | MACCHINE PER LA LAVORAZIONE DELLA GOMMA, ALTRE | TAGLIERINE | MACCHINE PER LAVORAZIONE SECONDARIA, ALTRE | FILIERE D'ESTRUSIONE | LAME E COLTELLI PER MACCHINE | ALTRE LAVORAZIONI MECCANICHE | MACCHINE PER SOFFIAGGIO DI  MATERIE PLASTICHE | MACCHINE E ATTREZZATURE PER L'INDUSTRIA DELLE MATERIE PLASTICHE E DELLA GOMMA | MACCHINE TRASFORMATRICI PER  MATERIE PLASTICHE E GOMMA,ALTRE | MACCHINE PER LAVORAZIONE SECONDARIA DI  MATERIE PLASTICHE E GOMMA | STAMPI E FILIERE PER  MATERIE PLASTICHE E GOMMA | PARTI E COMPONENTI DI MACCHINE  PER MATERIE PLASTICHE E GOMMA | LAVORAZIONI SECONDARIE | FORNITORI DI SEMILAVORATI O PRODOTTI FINITI IN  MATERIE PLASTICHE E GOMMA E SERVIZI DI LAVORAZIONE C",
IMEX ITALIA,https://dp-plast.fieramilano.it/exhibitor/14,https://dp-plast.fieramilano.it/exhibitor/14,Via Valpolicella 70,37029,SAN PIETRO IN CARIANO,VR,Veneto,Italy,+39 045 6801792,info@imexitaliapresse.it,http://www.imexitaliapresse.it,24,C12 C16,,,,,"ATTREZZATURE PER RIDUZIONE DIMENSIONALE (FRANTUMATORI, TRITURATORI, GRANULATORI) | MACCHINE A INIEZIONE PER TERMOPLASTICI OLTRE 10000 KN DI FORZA DI CHIUSURA | MACCHINE A INIEZIONE PER GOMMA | MACCHINE A INIEZIONE PER MULTICOMPONENTI | MACCHINE A INIEZIONE MULTISTAZIONE | MACCHINE A INIEZIONE PER TERMOPLASTICI FINO A 250 KN DI FORZA DI CHIUSURA | MACCHINE A INIEZIONE PER TERMOPLASTICI DA 4000 KN FINO A 10000 KN DI FORZA DI CHIUSURA | MACCHINE A INIEZIONE PER TERMOPLASTICI DA 250 KN FINO A 1000 KN DI FORZA DI CHIUSURA | MACCHINE A INIEZIONE PER TERMOPLASTICI DA 1000 KN FINO A 4000 KN DI FORZA DI CHIUSURA | MACCHINE A INIEZIONE PER TERMOINDURENTI | DOSATORI E MISCELATORI | ATTREZZATURE DI MANIPOLAZIONE PER CARICO/SCARICO DELLE MACCHINE | ESSICCATORI/DEUMIDIFICATORI PER MATERIALI IN MASSA | A","Imex Italia ha ampliato nel corso degli anni l'offerta prodotti, per soddisfare al meglio ogni necessità, fornendo soluzioni personalizzate e progetti su misura. Presse orizzontali, verticali, idrauliche, ibride o elettriche. Un’ampia gamma di modelli di diverso tonnellaggio e con forza di chiusura da 150 a 68.000 kN ci permette di soddisfare svariati settori tra cui automotive, medicale, elettronico, elettrico e molti altri ancora."
OMG,https://dp-plast.fieramilano.it/exhibitor/15,https://dp-plast.fieramilano.it/exhibitor/15,Via Torino 78,10040,GIVOLETTO,TO,Piemonte,Italy,+39 011 9947156,info@omgitaly.com,http://www.omgitaly.com,13,L02 L04,,,,,"TERMOFORMATRICI | BLISTERATRICI | FUSTELLATRICI E PERFORATRICI | PALLETTIZZATRICI | STAMPI PER TERMOFORMATURA | MACCHINE PER LAVORAZIONE SECONDARIA DI  MATERIE PLASTICHE E GOMMA | MACCHINE E ATTREZZATURE PER L'INDUSTRIA DELLE MATERIE PLASTICHE E DELLA GOMMA | MACCHINE E IMPIANTI PER FINITURA, DECORAZIONE, STAMPA E E MARCATURA DI PRODOTTI IN MATERIE PLASTICHE | STAMPI E FILIERE PER  MATERIE PLASTICHE E GOMMA",
OMP CONVEYORS,https://dp-plast.fieramilano.it/exhibitor/16,https://dp-plast.fieramilano.it/exhibitor/16,Via Pablo Neruda 34,25020,FLERO,BS,Lombardia,Italy,+39 030 3581711,info@ompconveyors.com,http://www.ompconveyors.com,24,D66,,,,,"ATTREZZATURE PER RIDUZIONE DIMENSIONALE (FRANTUMATORI, TRITURATORI, GRANULATORI) | MACCHINE A INIEZIONE PER TERMOPLASTICI OLTRE 10000 KN DI FORZA DI CHIUSURA | MACCHINE A INIEZIONE, ALTRE | MACCHINE A INIEZIONE PER TERMOPLASTICI FINO A 250 KN DI FORZA DI CHIUSURA | MACCHINE A INIEZIONE PER TERMOPLASTICI DA 4000 KN FINO A 10000 KN DI FORZA DI CHIUSURA | MACCHINE A INIEZIONE PER TERMOPLASTICI DA 250 KN FINO A 1000 KN DI FORZA DI CHIUSURA | MACCHINE A INIEZIONE PER TERMOPLASTICI DA 1000 KN FINO A 4000 KN DI FORZA DI CHIUSURA | MACCHINE E ATTREZZATURE PER LA PREPARAZIONE E IL RICICLAGGIO DELLE MATERIE PLASTICHE E DELLA GOMMA | MACCHINE E ATTREZZATURE PER L'INDUSTRIA DELLE MATERIE PLASTICHE E DELLA GOMMA | MACCHINE A INIEZIONE PER  MATERIE PLASTICHE E GOMMA",
TOSH,https://dp-plast.fieramilano.it/exhibitor/17,https://dp-plast.fieramilano.it/exhibitor/17,"Via Lambro 84, Frazione Quinto de Stampi",20089,ROZZANO,MI,Lombardia,Italy,+39 02 575661,info@tosh.it,http://www.tosh.it,22,B91 B95,,,,,"MACCHINE PER STAMPA SU PRODOTTI IN PLASTICA E GOMMA | STAMPATRICI, ALTRE | MACCHINE E IMPIANTI PER FINITURA, DECORAZIONE, STAMPA E MARCATURA, ALTRE E LINEE DI CONFEZIONAMENTO | DISPOSITIVI DI MARCATURA | ATTREZZATURE DI PRETRATTAMENTO SUPERFICIALE | MACCHINE E IMPIANTI PER FINITURA, DECORAZIONE, STAMPA E E MARCATURA DI PRODOTTI IN MATERIE PLASTICHE | MACCHINE E ATTREZZATURE PER L'INDUSTRIA DELLE MATERIE PLASTICHE E DELLA GOMMA | ATTREZZATURE AUSILIARIE PER LA LAVORAZIONE DI  MATERIE PLASTICHE E GOMMA",
UNION,https://dp-plast.fieramilano.it/exhibitor/18,https://dp-plast.fieramilano.it/exhibitor/18,Via I Maggio 12/14,20028,SAN VITTORE OLONA,MI,Lombardia,Italy,+39 0331 519300,info@unionextrusion.it,http://www.unionextrusion.it,15,G67 J72,,,,,"IMPIANTI DI RICICLAGGIO | IMPIANTI D'ESTRUSIONE PER FILM-FOGLIE-LASTRE | IMPIANTI D'ESTRUSIONE PER REGGETTE | ESTRUSORI MONOVITE | ESTRUSORI BIVITE | IMPIANTI D'ESTRUSIONE PER MONO E MULTIFILAMENTI | IMPIANTI D'ESTRUSIONE PER TUBI E PROFILI | IMPIANTI D'ESTRUSIONE PER ACCOPPIAMENTO E SPALMATURA | IMPIANTI D'ESTRUSIONE PER RIVESTIMENTO DI TUBI E CAVI | IMPIANTI D'ESTRUSIONE PER COMPOUND | IMPIANTI D'ESTRUSIONE, ALTRI | MACCHINE PER ESPANSI, ALTRE | MACCHINE E ATTREZZATURE PER LA PREPARAZIONE E IL RICICLAGGIO DELLE MATERIE PLASTICHE E DELLA GOMMA | MACCHINE E ATTREZZATURE PER L'INDUSTRIA DELLE MATERIE PLASTICHE E DELLA GOMMA | ESTRUSORI E IMPIANTI D'ESTRUSIONE PER  MATERIE PLASTICHE E GOMMA | MACCHINE PER ESPANSI E RESINE REATTIVE O RINFORZATE","Fondata nel 1950, Union Officine Meccaniche s.p.a. è un’azienda leader nel settore dell’estrusione di materiali rigidi ed espansi, specializzata nella realizzazione di impianti completi ad alta tecnologia e componenti atti ad implementare impianti esistenti."
NG LABTEC,https://dp-plast.fieramilano.it/exhibitor/19,https://dp-plast.fieramilano.it/exhibitor/19,Via Bianzanella 6/A,24124,BERGAMO,BG,Lombardia,Italy,+39 035 4175268,info@nglabtec.com,http://www.nglabtec.com,11,B66 B68,,,,,"ALTRE APPARECCHIATURE PER MISURE E PROVE PER PROPRIETÀ MECCANICHE E DINAMICHE | APPARECCHIATURE PER MISURE E PROVE PER PROPRIETÀ REOLOGICHE | APPARECCHIATURE PER MISURE E PROVE PER PROPRIETÀ TERMICHE | APPARECCHIATURE PER CONTROLLI E PROVE, ALTRE | STRUMENTI DI PRECISIONE | PROVE, MISURE E CONTROLLI | CONTROLLI DI PROCESSO | ATTREZZATURE AUSILIARIE PER LA LAVORAZIONE DI  MATERIE PLASTICHE E GOMMA | MACCHINE E ATTREZZATURE PER L'INDUSTRIA DELLE MATERIE PLASTICHE E DELLA GOMMA | APPARECCHIATURE PER CONTROLLI E PROVE DI LABORATORIO | APPLICAZIONI INDUSTRIALI E AGRICOLE | FORNITORI DI SEMILAVORATI O PRODOTTI FINITI IN  MATERIE PLASTICHE E GOMMA E SERVIZI DI LAVORAZIONE C | FABBRICAZIONE E PROCESSO | SERVIZI DI CONSULENZA E ORGANIZZAZIONI PER IL SETTORE DELLE MATERIE PLASTICHE E DELLA GOMMA","NG Labtec Srl è distributore esclusivo per l'Italia di aziende leader nella produzione di strumentazione per la caratterizzazione di materiali e superfici. Con un'esperienza più che trentennale, operiamo in diversi ambiti applicativi e siamo in grado di proporre soluzioni per: • Misura del colore – con sistemi all'avanguardia per R&D, controllo qualità (QC) e controllo di processo, sia tramite spettrocolorimetri che sistemi visivi e di imaging; • Preparazione di campioni e caratterizzazione delle proprietà fisiche e meccaniche di materiali plastici – tra cui indice di fluidità (MFI), resilienza con pendolo Charpy/Izod, test di impatto e prove di trazione/compressione con dinamometro; • Trattamento superficiale al plasma – per migliorare la bagnabilità e l'energia superficiale di materiali polimerici prima di operazioni di stampa e incollaggio, incrementando l'adesione di adesivi, elastomeri, vernici e inchiostri; • Analisi dell'angolo di contatto – per la valutazione quantitativa della bagnabilità di una superficie e la verifica dell'efficacia di trattamenti superficiali; • Misura della granulometria e della morfologia delle particelle – sia a secco che in dispersione liquida, con analizzatori a diffrazione laser, analisi dinamica dell'immagine (DIA) e diffusione dinamica della luce (DLS); • Verifica della pulizia di superfici metalliche – per il rilevamento di residui organici. Ulteriori tecniche e soluzioni sono consultabili sul nostro sito web. Il nostro team di supporto t"
MAHLO,https://dp-plast.fieramilano.it/exhibitor/20,https://dp-plast.fieramilano.it/exhibitor/20,Donaustrasse 12,93342,Saal/Donau,,,Germany,+49 9441 6010,info@mahlo.com,http://www.mahlo.com,11,B126,,,,,CONTROLLI DI PROCESSO | MISURATORI DI SPESSORE | MISURATORI DI CONTENUTO D'UMIDITÀ | APPARECCHIATURE DI PESATURA DI PRECISIONE | ATTREZZATURE AUSILIARIE PER LA LAVORAZIONE DI  MATERIE PLASTICHE E GOMMA | MACCHINE E ATTREZZATURE PER L'INDUSTRIA DELLE MATERIE PLASTICHE E DELLA GOMMA,"Mahlo GmbH + Co. KG, con sede a Saal an der Donau in Germania, è un leader mondiale nei sistemi di misura, controllo e automazione online per processi a nastro continuo, con competenze sviluppate dal 1945.
 Per l’industria delle materie plastiche, Mahlo offre soluzioni ad alta precisione per l’estrusione di film e per i processi di coating e laminazione, consentendo la misura in linea di spessore, peso areico e strutture multistrato, oltre al controllo del profilo sull’intera larghezza del nastro. Tecnologie di sensori avanzate garantiscono un monitoraggio continuo della qualità in tempo reale e condizioni di produzione stabili.
 In questo modo, Mahlo supporta produttori di film e converter nel garantire qualità costante, ridurre gli scarti e ottimizzare l’efficienza e la sostenibilità dei processi produttivi."
FRIGOSYSTEM,https://dp-plast.fieramilano.it/exhibitor/21,https://dp-plast.fieramilano.it/exhibitor/21,Via J.F. Kennedy 240,21042,CARONNO PERTUSELLA,VA,Lombardia,Italy,+39 02 9658610,info@frigosystem.it,http://www.frigosystem.it,15,E41 G50,,,,,"ATTREZZATURE PER LA PREPARAZIONE E IL RICICLAGGIO, ALTRE | IMPIANTI D'ESTRUSIONE, ALTRI | PRESSE, ALTRE | MACCHINE PER SOFFIAGGIO DI  MATERIE PLASTICHE, ALTRE | MACCHINE A INIEZIONE, ALTRE | MACCHINE PER RESINE REATTIVE RINFORZATE, ALTRE | MACCHINE PER ESPANSI, ALTRE | MACCHINE TRASFORMATRICI, ALTRE | MACCHINE PER LAVORAZIONE SECONDARIA, ALTRE | MACCHINE E IMPIANTI PER FINITURA, DECORAZIONE, STAMPA E MARCATURA, ALTRE E LINEE DI CONFEZIONAMENTO | REFRIGERATORI D'ACQUA | UNITÀ DI RISCALDAMENTO E RAFFREDDAMENTO PER STAMPI E FILIERE | ATTREZZATURE AUSILIARIE PER LA LAVORAZIONE DI  MATERIE PLASTICHE E GOMMA, ALTRE | DISPOSITIVI PER IL CONTROLLO DI TEMPERATURA | PARTI E COMPONENTI DI MACCHINE PER MATERIE PLASTICHE E GOMMA, ALTRE | MACCHINE E ATTREZZATURE PER LA PREPARAZIONE E IL RICICLAGGIO DELL","Fondata nel 1970, Frigosyste Corema è tuttora focalizzata sulla progettazione, produzione e vendita di refrigeratori industriali e termoregolatori, vantando una lunga esperienza nei sistemi ad alta precisione.
 L’ampia gamma di prodotti consente di soddisfare le esigenze specifiche sia della piccola sia della grande industria: Frigosystem-Corema è in grado di strutturare la propria offerta"
FRIGOSYSTEM,https://dp-plast.fieramilano.it/exhibitor/22,https://dp-plast.fieramilano.it/exhibitor/22,Via J.F. Kennedy 240,21042,CARONNO PERTUSELLA,VA,Lombardia,Italy,+39 02 9658610,info@frigosystem.it,http://www.frigosystem.it,24,C11,,,,,,"Fondata nel 1970, Frigosystem-Corema è tuttora focalizzata sulla progettazione, produzione e vendita di refrigeratori industriali e termoregolatori, vantando una lunga esperienza nei sistemi ad alta precisione.
 L’ampia gamma di prodotti consente di soddisfare le esigenze specifiche sia della piccola sia della grande industria: Frigosystem-Corema è in grado di strutturare la propria offerta con impianti e soluzioni su misura, sempre orientati all’efficienza e al risparmio energetico."
EPISTOLIO,https://dp-plast.fieramilano.it/exhibitor/23,https://dp-plast.fieramilano.it/exhibitor/23,Via Scerei 4,21020,CASCIAGO,VA,Lombardia,Italy,+39 0332 212692,info@epistolio.com,http://www.epistolio.com,13,M26,,,,,"ATTREZZATURE DI DOSAGGIO | TRASPORTATORI A VITE | CONTROLLI DI PROCESSO | APPARECCHIATURE DI PESATURA DI PRECISIONE | PARTI E COMPONENTI DI MACCHINE PER MATERIE PLASTICHE E GOMMA, ALTRE | ATTREZZATURE AUSILIARIE PER LA LAVORAZIONE DI  MATERIE PLASTICHE E GOMMA | MACCHINE E ATTREZZATURE PER L'INDUSTRIA DELLE MATERIE PLASTICHE E DELLA GOMMA | PARTI E COMPONENTI DI MACCHINE  PER MATERIE PLASTICHE E GOMMA","Epistolio Group è un’azienda leader nel settore dell’automazione industriale, specializzata nella fornitura di componentistica, progettazione e realizzazione di robot ed impianti di verniciatura, sistemi di dosaggio gravimetrico e soluzioni di trasporto e movimentazione. Fondata con l’obiettivo di offrire tecnologie avanzate, Epistolio Group si distingue per l’innovazione e un servizio clienti eccellente, sempre al centro delle nostre attività"
GRUPPO VIGNATI,https://dp-plast.fieramilano.it/exhibitor/24,https://dp-plast.fieramilano.it/exhibitor/24,Via De Vecchi 10,20057,ASSAGO,MI,Lombardia,Italy,+39 02 48852001,info@vignati.it,http://www.vignati.it,11,C86,,,,,"STAMPI, ALTRI | STAMPI PER INIEZIONE/COMPRESSIONE | STAMPAGGIO A INIEZIONE | STAMPI E FILIERE PER  MATERIE PLASTICHE E GOMMA | MACCHINE E ATTREZZATURE PER L'INDUSTRIA DELLE MATERIE PLASTICHE E DELLA GOMMA | FORNITURA DI LAVORAZIONI PER CONTO TERZI | FORNITORI DI SEMILAVORATI O PRODOTTI FINITI IN  MATERIE PLASTICHE E GOMMA E SERVIZI DI LAVORAZIONE C",
CARLASSARA,https://dp-plast.fieramilano.it/exhibitor/25,https://dp-plast.fieramilano.it/exhibitor/25,Via San Francesco 37,21020,INARZO,VA,Lombardia,Italy,+39 0332 964245,acquisti@carlassara.it,http://www.carlassara.it,13,M25,,,,,"IMPIANTI D'ESTRUSIONE PER FILM-FOGLIE-LASTRE | ESTRUSORI MONOVITE | ESTRUSORI, ALTRI | IMPIANTI D'ESTRUSIONE PER TUBI E PROFILI | IMPIANTI D'ESTRUSIONE, ALTRI | TAGLIERINE | AVVOLGITORI-BOBINATORI | ESTRUSORI E IMPIANTI D'ESTRUSIONE PER  MATERIE PLASTICHE E GOMMA | MACCHINE E ATTREZZATURE PER L'INDUSTRIA DELLE MATERIE PLASTICHE E DELLA GOMMA | MACCHINE PER LAVORAZIONE SECONDARIA DI  MATERIE PLASTICHE E GOMMA","Carlassara è un’azienda italiana specializzata nella progettazione e produzione di linee di estrusione per materie plastiche, tubi e profili. Grazie a un forte know-how tecnico e a un approccio su misura, sviluppa soluzioni personalizzate in base alle esigenze specifiche dei clienti, garantendo qualità, affidabilità e innovazione per il mercato internazionale."
BAUSANO,https://dp-plast.fieramilano.it/exhibitor/26,https://dp-plast.fieramilano.it/exhibitor/26,Corso Indipendenza 111,10086,RIVAROLO CANAVESE,TO,Piemonte,Italy,+39 0124 26326,info@bausano.com,http://www.bausano.com,13,E33 F34,,,,,"ESTRUSORI MONOVITE | ESTRUSORI BIVITE | IMPIANTI D'ESTRUSIONE PER RIVESTIMENTO DI TUBI E CAVI | IMPIANTI D'ESTRUSIONE PER COMPOUND | IMPIANTI D'ESTRUSIONE, ALTRI | ESTRUSORI E IMPIANTI D'ESTRUSIONE PER  MATERIE PLASTICHE E GOMMA | MACCHINE E ATTREZZATURE PER L'INDUSTRIA DELLE MATERIE PLASTICHE E DELLA GOMMA","Bausano è un’azienda italiana specializzata nello sviluppo di tecnologie avanzate per l’estrusione delle materie plastiche, con una gamma completa di estrusori bivite, monovite e linee di estrusione turnkey.
 Le soluzioni bivite sono progettate per la trasformazione del PVC rigido e plastificato, con elevata efficienza di plastificazione, controllo termico accurato e stabilità del melt. Trovano applicazione nella produzione di tubi in PVC-U e PVC-C per pressione, scarico e fognatura, in configurazione mono e multistrato, oltre che in profili tecnici e per serramenti in PVC.
 Le tecnologie monovite coprono la lavorazione di poliolefine come PE, HDPE e PP, per la produzione di tubi lisci e corrugati, anche multistrato, garantendo alte portate e flessibilità operativa.
 L’offerta include inoltre linee dedicate al riciclo, sviluppate per il recupero di sfridi industriali e materiali post-consumo, con l’obiettivo di ottenere un materiale omogeneo e reprocessabile, idoneo al reinserimento nei cicli produttivi.
 Il valore distintivo di Bausano risiede in un approccio engineering-driven e su misura: ogni soluzione viene sviluppata a partire dall’analisi della formulazione, del comportamento reologico del materiale e delle specifiche applicative, ottimizzando configurazione vite, lay-out impianto e parametri di processo. L’integrazione di sistemi digitali avanzati e algoritmi di intelligenza artificiale consente il monitoraggio continuo delle performance e l’ottimizzazione predittiva "
