nome,url,url_canonical,indirizzo,cap,citta,provincia,regione,paese,telefono,email,sito_web,padiglione,stand,coespositore,espositore_principale,partita_iva,marchi,categorie,descrizione
MITEX,https://dp-plast.fieramilano.it/exhibitor/445,https://dp-plast.fieramilano.it/exhibitor/445,"Room 103, Building 2, N. 3 Yinxing Road Xiegang Town",523598,"Dongguan City, Guangdong Province",,,China,+86 769 82027502,jessica@mitexltd.com,http://www.mitexltd.com,22,C55,,,,,"ATTREZZATURE DI DOSAGGIO | CONVOGLIATORI E SISTEMI DI TRASPORTO DI POLVERI E GRANULI (ESCLUSI CARRELLI E CARRELLI ELEVATORI) | ESSICCATORI/DEUMIDIFICATORI PER MATERIALI IN MASSA | REFRIGERATORI D'ACQUA | UNITÀ DI RISCALDAMENTO E RAFFREDDAMENTO PER STAMPI E FILIERE | SEPARATORI DI METALLI | TRASPORTATORI A VITE | TRASPORTATORI A SPIRALE | ATTREZZATURE AUSILIARIE PER LA LAVORAZIONE DI  MATERIE PLASTICHE E GOMMA, ALTRE | APPARECCHIATURE DI PESATURA DI PRECISIONE | MISCELATORI DI TIPO CONTINUO PER SOLIDI | MISCELATORI DI TIPO DISCONTINUO PER SOLIDI | ATTREZZATURE AUSILIARIE PER LA LAVORAZIONE DI  MATERIE PLASTICHE E GOMMA | MACCHINE E ATTREZZATURE PER L'INDUSTRIA DELLE MATERIE PLASTICHE E DELLA GOMMA | CONTROLLI DI PROCESSO","DONGGUAN MITEX MACHINERY TECHNOLOGY CO.,LTD è un'azienda high-tech di livello nazionale fondata nel luglio 2007. È anche un produttore di macchinari per la lavorazione della plastica specializzato in ricerca e sviluppo, produzione e vendita ai clienti per progetti di impianti, progettazione e soluzioni per la moderna Industria 4.0. I principali prodotti includono: sistemi di alimentazione centralizzata, sistemi di deumidificazione e asciugatura, sistemi di dosaggio e miscelazione automatici, sistemi di frantumazione e recupero, sistemi di controllo della temperatura degli stampi e soluzioni automatiche, ecc. Questi prodotti trovano ampia applicazione nei settori dei componenti elettronici, dello stampaggio della plastica, dell'industria automobilistica e medicale, dei connettori per computer, delle lenti ottiche, della pressofusione di componenti hardware e degli elettrodomestici, ecc. Mitex persegue costantemente l'innovazione indipendente per diversi dispositivi e si impegna a fornire il miglior servizio e un'elevata qualità, instaurando una solida collaborazione con i propri clienti. Ci concentreremo sempre di più sulla soddisfazione delle esigenze dei clienti, fornendo i sistemi e i servizi di stampaggio più avanzati, riducendo i costi e creando maggiore valore per i nostri clienti, condividendo il successo reciproco."
VICTORY FIRE-RETARDANT,https://dp-plast.fieramilano.it/exhibitor/447,https://dp-plast.fieramilano.it/exhibitor/447,"Industrial Park, Qingyishan Town, Kuandian Manchu  Autonomous County",118200,"Dandong City, Liaoning Province",,,China,+86 415 5512939,info@tiancifr.com,http://www.victoryfr.com,11,D24,,,,,"MASTERBATCH RITARDANTI DI FIAMMA | ALTRI MASTERBATCH | ALTRI ADDITIVI E AUSILIARI | CARICHE E RIEMPITIVI MINERALI | PIGMENTI, COLORANTI E MASTERBATCH | MATERIE PRIME, RIGENERATE E COMPOSITI | ALTRI ADDITIVI E AUSILIARI DI PROCESSO | CARICHE E RINFORZI",
XIECHENG,https://dp-plast.fieramilano.it/exhibitor/448,https://dp-plast.fieramilano.it/exhibitor/448,"N. 17, Huizhi Road, Da'ze Town, XinHui District",529100,"Jiangmen City, Guangdong",,,China,+86 750 8222682,amyzhau@jmxiecheng.com,http://www.jmxiecheng.com,22,C51,,,,,"ATTREZZATURE PER RIDUZIONE DIMENSIONALE (FRANTUMATORI, TRITURATORI, GRANULATORI) | ATTREZZATURE PER LA PREPARAZIONE E IL RICICLAGGIO, ALTRE | DOSATORI E MISCELATORI | SILOS E DISPOSITIVI DI SCARICO SILOS | ATTREZZATURE DI DOSAGGIO | CONVOGLIATORI E SISTEMI DI TRASPORTO DI POLVERI E GRANULI (ESCLUSI CARRELLI E CARRELLI ELEVATORI) | ESSICCATORI/DEUMIDIFICATORI PER MATERIALI IN MASSA | REFRIGERATORI D'ACQUA | MAGAZZINI STAMPI | UNITÀ DI RISCALDAMENTO E RAFFREDDAMENTO PER STAMPI E FILIERE | ATTREZZATURE AUSILIARIE PER LA LAVORAZIONE DI  MATERIE PLASTICHE E GOMMA, ALTRE | APPARECCHIATURE DI PESATURA DI PRECISIONE | MISCELATORI DI TIPO DISCONTINUO PER SOLIDI | MACCHINE E ATTREZZATURE PER LA PREPARAZIONE E IL RICICLAGGIO DELLE MATERIE PLASTICHE E DELLA GOMMA | MACCHINE E ATTREZZATURE PER L'INDUST","La Guangdong Xiecheng Intelligent Equipment Co., Ltd. è stata fondata a Jiangmen, Guangdong, Cina, nel 2009. È un fornitore di soluzioni per apparecchiature di controllo della temperatura industriale di alta precisione, sia a caldo che a freddo, apparecchiature ausiliarie per l'automazione dello stampaggio di gomma e plastica e sistemi integrati intelligenti. Ha ricevuto riconoscimenti come piccola e media impresa specializzata, raffinata, innovativa e di spicco, nonché come impresa nazionale ad alta tecnologia e piccola e media impresa innovativa. Xiecheng è già diventata un marchio rinomato nel settore della plastica, con prodotti venduti in oltre 130 paesi e regioni, tra cui Asia, Europa, Oceania, Nord e Sud America, Africa e Medio Oriente. Con oltre 15 anni di esperienza in ricerca e sviluppo e produzione, un team di oltre 30 tecnici specializzati in ricerca e sviluppo e oltre 250 dipendenti nel centro di produzione, Xiecheng collabora anche con università e istituti di istruzione superiore per la creazione di una base di collaborazione industria-università-ricerca e di un centro di ricerca per l'innovazione collaborativa, oltre alla fase di preparazione di una stazione di ricerca post-dottorato, presso la South China University of Technology (SCUT), la Wuyi University e la Jiangmen Technician Academy. Finora Xiecheng ha ottenuto più di 50 brevetti in invenzioni, modelli di utilità e diritti d'autore su software, ecc. Xiecheng fornisce soluzioni per il controllo della tem"
WOVEN TECH EQUIPMENT,https://dp-plast.fieramilano.it/exhibitor/449,https://dp-plast.fieramilano.it/exhibitor/449,"Lanshan District, Linyi City",276000,Shandong,,,China,+86 19863951364,woventec@gmail.com,http://www.woventec.com,15,T45,,,,,"MACCHINE E ATTREZZATURE PER L'INDUSTRIA DELLE MATERIE PLASTICHE E DELLA GOMMA | MACCHINE E ATTREZZATURE PER LA PREPARAZIONE E IL RICICLAGGIO DELLE MATERIE PLASTICHE E DELLA GOMMA | ATTREZZATURE PER LA PREPARAZIONE E IL RICICLAGGIO, ALTRE | ESTRUSORI E IMPIANTI D'ESTRUSIONE PER  MATERIE PLASTICHE E GOMMA | IMPIANTI D'ESTRUSIONE PER FILM SOFFIATO | IMPIANTI D'ESTRUSIONE PER ACCOPPIAMENTO E SPALMATURA | IMPIANTI D'ESTRUSIONE PER COMPOUND | MACCHINE PER SOFFIAGGIO DI  MATERIE PLASTICHE | MACCHINE PER ESTRUSIONE/SOFFIAGGIO | MACCHINE PER LAVORAZIONE SECONDARIA DI  MATERIE PLASTICHE E GOMMA | TAGLIERINE | AVVOLGITORI-BOBINATORI | SALDATRICI PER  MATERIE PLASTICHE E GOMMA | SALDATRICI A IMPULSO TERMICO | SALDATRICI PER LA PRODUZIONE DI SACCHI E SACCHETTI | MACCHINE E IMPIANTI PER FINITURA, DECORA",
JIADE MACHINERY,https://dp-plast.fieramilano.it/exhibitor/450,https://dp-plast.fieramilano.it/exhibitor/450,"N.85 Nanshantou, Wangjia Villiage, Changjing Town",214400,"Jiangyin City, Jiangsu Province",,,China,+86 510 86114235,owen@gader-cn.com,https://en.jyjiade.com,15,U44,,,,,"MACCHINE TRASFORMATRICI, ALTRE | TAGLIERINE | AVVOLGITORI-BOBINATORI | FUSTELLATRICI E PERFORATRICI | MACCHINE E IMPIANTI PER FINITURA, DECORAZIONE, STAMPA E MARCATURA, ALTRE E LINEE DI CONFEZIONAMENTO | CONFEZIONATRICI | CASALINGHI | IMBALLAGGIO | MACCHINE TRASFORMATRICI PER  MATERIE PLASTICHE E GOMMA,ALTRE | MACCHINE E ATTREZZATURE PER L'INDUSTRIA DELLE MATERIE PLASTICHE E DELLA GOMMA | MACCHINE PER LAVORAZIONE SECONDARIA DI  MATERIE PLASTICHE E GOMMA | MACCHINE E IMPIANTI PER FINITURA, DECORAZIONE, STAMPA E E MARCATURA DI PRODOTTI IN MATERIE PLASTICHE | APPLICAZIONI DOMESTICHE | FORNITORI DI SEMILAVORATI O PRODOTTI FINITI IN  MATERIE PLASTICHE E GOMMA E SERVIZI DI LAVORAZIONE C","Leadership di Mercato e Riconoscimento Globale： JIADE MACHINERY, con 30 anni di esperienza, è un produttore leader nazionale di macchine per la produzione di sacchetti in rotolo a Jiangyin, vicino a Shanghai. Abbiamo 110 dipendenti e uno stabilimento di 20.000 m². La produzione annuale supera i 700 macchinari, leader nel mercato cinese, con esportazioni in oltre 40 paesi. Prodotti principali: Macchina per la produzione di sacchetti in rotolo Estrusore per film (macchina per la soffiatura di film)"
DGAX,https://dp-plast.fieramilano.it/exhibitor/451,https://dp-plast.fieramilano.it/exhibitor/451,3rd Building #189 Hongchan Road Xiaoshan District,311200,Hangzhou,,,China,+86 18929294698,connie@ax-pack.com,http://www.dgaxvision.com,15,U41,,,,,"MACCHINE PER LA LAVORAZIONE DELLA GOMMA, ALTRE | MACCHINE TRASFORMATRICI, ALTRE | SILICONICI | IGIENE PERSONALE | TELECOMUNICAZIONI | APPLICAZIONI A ELEVATA TECNOLOGIA INDUSTRIA AEROSPAZIALE | ALTRE APPLICAZIONI A ELEVATA TECNOLOGIA | ATTREZZATURE PER UFFICIO | IMBALLAGGIO | ALTRE LAVORAZIONI MECCANICHE | ALTRE OPERAZIONI DI POST-FINITURA | AUTOMAZIONE, ROBOTICA E INFORMATICA | GARANZIA DI QUALITA' | MACCHINE TRASFORMATRICI PER  MATERIE PLASTICHE E GOMMA,ALTRE | MACCHINE E ATTREZZATURE PER L'INDUSTRIA DELLE MATERIE PLASTICHE E DELLA GOMMA | ELASTOMERI | MATERIE PRIME, RIGENERATE E COMPOSITI | PRODOTTI FINITI | FORNITORI DI SEMILAVORATI O PRODOTTI FINITI IN  MATERIE PLASTICHE E GOMMA E SERVIZI DI LAVORAZIONE C | APPLICAZIONI DOMESTICHE | LAVORAZIONI SECONDARIE | FORNITORI DI OPERAZIONI POST",
JBS,https://dp-plast.fieramilano.it/exhibitor/452,https://dp-plast.fieramilano.it/exhibitor/452,"4th Floor, Building 3,Yangtze River Delta National Technology Innovation Center, N.1 Huafu Road",211800,Nanjing,,,China,+86 19844542676,chongbo.yin@jiabosheng.com,http://www.jiabosheng.com,11,D22,,,,,"POLIMETILMETACRILATO (PMMA) | POLIETILENTEREFTALATO RIGENERATO (R PET) | POLICARBONATO (PC) | POLIETILENE RIGENERATO (R PE) | POLIPROPILENE RIGENERATO (R PP) | POLISTIRENE (GPPS, HIPS, EPS) | ACRILONITRILE-BUTADIENE-STIRENE RIGENERATO (R ABS) | ACETALICHE (POM) | CLORURO DI POLIVINILE RIGENERATO (R PVC) | ELASTOMERI RIGENERATI | ETILENE-VINILACETATO (EVA) | FILM TRASPARENTI, FOGLIE E LASTRE-NASTRI | PRODUZIONE DI FILM | ACRILICHE | MATERIE PRIME, RIGENERATE E COMPOSITI | POLIESTERI TERMOPLASTICI | POLIOLEFINICHE | STIRENICHE E COPOLIMERI A BASE DI STIRENE | ALTRE MATERIE PLASTICHE | VINILICHE | ELASTOMERI | SEMILAVORATI E PRODOTTI DI FINITURA | FORNITORI DI SEMILAVORATI O PRODOTTI FINITI IN  MATERIE PLASTICHE E GOMMA E SERVIZI DI LAVORAZIONE C | FORNITURA DI LAVORAZIONI PER CONTO TERZI",
MICMIC,https://dp-plast.fieramilano.it/exhibitor/453,https://dp-plast.fieramilano.it/exhibitor/453,"828 Xueyuan Road, Bacheng Town",215311,"Kunshan City, Jiangsu Province",,,China,+86 18061090691,michal@szmicmic.cn,http://www.szmicmic.com,11,D26,,,,,"DISPOSITIVI E SISTEMI DI CONTROLLO E SUPERVISIONE, ALTRI | APPARECCHIATURE PER MISURE E PROVE PER PROPRIETÀ REOLOGICHE | APPARECCHIATURE PER MISURE E PROVE PER PROPRIETÀ MECCANICHE E DINAMICHE | APPARECCHIATURE PER MISURE E PROVE PER PROPRIETÀ TERMICHE | APPARECCHIATURE PER MISURE E PROVE PER PROPRIETÀ ELETTRICHE | APPARECCHIATURE PER CONTROLLI E PROVE, ALTRE | ATTREZZATURE AUSILIARIE PER LA LAVORAZIONE DI  MATERIE PLASTICHE E GOMMA | MACCHINE E ATTREZZATURE PER L'INDUSTRIA DELLE MATERIE PLASTICHE E DELLA GOMMA | APPARECCHIATURE PER CONTROLLI E PROVE DI LABORATORIO",
HAIYANG TECHNOLOGY,https://dp-plast.fieramilano.it/exhibitor/454,https://dp-plast.fieramilano.it/exhibitor/454,"N,122 Haiyang West Rd, Hailing District",225300,Taizhou,,,China,+86 523 86573926,bill@pa6.com.cn,http://www.pa6.com.cn,9,B113,,,,,"POLIAMMIDE 6 (PA 6) | POLIAMMIDICHE | MATERIE PRIME, RIGENERATE E COMPOSITI","Fondati nel 1970, vantiamo oltre 50 anni di esperienza nelle materie prime PA6 e nei polimeri compound PA6.66. Di seguito l'elenco prodotti per vostro riferimento: PA6 grado vergine, viscosità relativa 2.45/2.7/3.3/3.8 PA6.66 Copolimero, viscosità relativa 3.3/4.0 Polimero compound PA6.66"
BEIER,https://dp-plast.fieramilano.it/exhibitor/455,https://dp-plast.fieramilano.it/exhibitor/455,North Second Ring  Road and City Avenue  Intersection,215600,Jiangsu Province,,,China,+86 512 58682198,info@beierpm.com,http://www.beierpm.com,13,T21,,,,,"IMPIANTI D'ESTRUSIONE PER TUBI E PROFILI | IMPIANTI D'ESTRUSIONE PER GOMMA | MISCELATORI, ALTRI | ESTRUSORI E IMPIANTI D'ESTRUSIONE PER  MATERIE PLASTICHE E GOMMA | MACCHINE E ATTREZZATURE PER L'INDUSTRIA DELLE MATERIE PLASTICHE E DELLA GOMMA","BEIER Machinery Group è un fornitore integrato di apparecchiature che accelera la transizione delle tecnologie di estrusione e riciclo della plastica verso un’economia verde e circolare. Come azienda impegnata nella sostenibilità, il Gruppo BEIER integra tre principali unità di business—estrusione e stampaggio della plastica, soluzioni di miscelazione e compound, e sistemi di riciclo della plastica—per offrire al mercato globale una soluzione completa che bilancia qualità della vita e sostenibilità ambientale.
 Dal 1998, BEIER fornisce linee di produzione efficienti ed energeticamente sostenibili in stile europeo per tubi PE/PP/PPR/PVC, lastre e profili, oltre a compounding PVC, sistemi di alimentazione di precisione e linee di riciclo dei rifiuti plastici, servendo clienti in 125 paesi e regioni in tutto il mondo. Grazie a prestazioni produttive stabili e sostenibili, BEIER ha creato valore per oltre 600 aziende del settore plastico, instaurando solide partnership per promuovere insieme lo sviluppo dell’economia circolare nelle infrastrutture pubbliche, nel settore delle costruzioni e nel riciclo della plastica.
 L’innovazione è uno dei valori fondamentali di BEIER, che guida l’evoluzione e la crescita continua dell’azienda. Attraverso aggiornamenti tecnologici, prodotti e servizi migliorati, soddisfazione del cliente e contributi alla società, BEIER costruisce la propria reputazione e realizza la mission del brand: “Innovare per la sostenibilità, orgogliosi del successo dei"
CHENGHENG PLASTIC,https://dp-plast.fieramilano.it/exhibitor/456,https://dp-plast.fieramilano.it/exhibitor/456,"South of Qiaojiazhai Village Hequ Town, Ningjin  County, Xingtai City",055550,Hebei,,,China,+86 15530901998,miranda@cnchengheng.com,http://www.cnchengheng.com,15,T41,,,,,IMPIANTI D'ESTRUSIONE PER FILM SOFFIATO | ESTRUSORI MONOVITE | ESTRUSORI BIVITE | ESTRUSORI E IMPIANTI D'ESTRUSIONE PER  MATERIE PLASTICHE E GOMMA | MACCHINE E ATTREZZATURE PER L'INDUSTRIA DELLE MATERIE PLASTICHE E DELLA GOMMA,
SEAL MOULD,https://dp-plast.fieramilano.it/exhibitor/457,https://dp-plast.fieramilano.it/exhibitor/457,"N. 238 North Road, Liangtian Industrial Park Zhongluotan Town, Baiyun District",510545,Guangzhou,,,China,+86 020 86041299,info@seal-rp.com,http://www.seal-mould.cn/en/,22,D41,,,,,"STAMPI, ALTRI | STAMPAGGIO A INIEZIONE | STAMPI E FILIERE PER  MATERIE PLASTICHE E GOMMA | MACCHINE E ATTREZZATURE PER L'INDUSTRIA DELLE MATERIE PLASTICHE E DELLA GOMMA | FORNITURA DI LAVORAZIONI PER CONTO TERZI | FORNITORI DI SEMILAVORATI O PRODOTTI FINITI IN  MATERIE PLASTICHE E GOMMA E SERVIZI DI LAVORAZIONE C",
ECHOFAST,https://dp-plast.fieramilano.it/exhibitor/458,https://dp-plast.fieramilano.it/exhibitor/458,"2-2 Beiyuan Avenue, Beicheng Street, Huangyan",318020,"Taizhou, Zhejiang",,,China,+86 13989613556,sales1@echofast.com,http://www.echo-fast.com,22,D52,,,,,STAMPI PER INIEZIONE/COMPRESSIONE | STAMPI E FILIERE PER  MATERIE PLASTICHE E GOMMA | MACCHINE E ATTREZZATURE PER L'INDUSTRIA DELLE MATERIE PLASTICHE E DELLA GOMMA,
LD PLASTIC,https://dp-plast.fieramilano.it/exhibitor/459,https://dp-plast.fieramilano.it/exhibitor/459,Dongjiang Town,265718,"Longkou City, Shandong Province",,,China,+86 535 8665366,nancyliu@longdanplastic.net,http://longdanplastic.en.alibaba.com,15,U46,,,,,"POLIETILENE BASSA DENSITA' (LDPE) | POLIETILENE LINEARE BASSA DENSITA' (LLDPE) | POLIETILENE ALTA DENSITA' (HDPE) | POLIOLEFINICHE | MATERIE PRIME, RIGENERATE E COMPOSITI",
XC EXTRUDER FILTER,https://dp-plast.fieramilano.it/exhibitor/460,https://dp-plast.fieramilano.it/exhibitor/460,"N.48#, Zhengchang Road, Zhanggang Industrial Park  Jiangdu District",225200,Yangzhou,,,China,+86 514 86546566,info@xc-filter.com,http://www.xc-filter.com,13,U28,,,,,FILTRI PER MASSE FUSE,
ZHITIAN,https://dp-plast.fieramilano.it/exhibitor/461,https://dp-plast.fieramilano.it/exhibitor/461,"Tianyuan Community, Chunhua Street Jiangning District",211122,Nanjing,,,China,+86 025 52294748,info@njzhitian.com,http://www.njzhitian.com,13,T25,,,,,"ESTRUSORI BIVITE | ESTRUSORI, ALTRI | IMPIANTI D'ESTRUSIONE PER COMPOUND | ESTRUSORI E IMPIANTI D'ESTRUSIONE PER  MATERIE PLASTICHE E GOMMA | MACCHINE E ATTREZZATURE PER L'INDUSTRIA DELLE MATERIE PLASTICHE E DELLA GOMMA",
YANCO MOULD,https://dp-plast.fieramilano.it/exhibitor/462,https://dp-plast.fieramilano.it/exhibitor/462,"N 62 Lianyu Road, Huangyan Gaoqiao Industrial Zone",318020,"Taizhou City, Zhejiang Province",,,China,+86 13675858637,sales@yancomould.com,http://www.yancomould.com,24,B65,,,,,"MACCHINE E ATTREZZATURE PER L'INDUSTRIA DELLE MATERIE PLASTICHE E DELLA GOMMA | STAMPI E FILIERE PER  MATERIE PLASTICHE E GOMMA | STAMPI, ALTRI | STAMPI PER INIEZIONE/COMPRESSIONE | STAMPI PER SOFFIAGGIO | FORNITORI DI SEMILAVORATI O PRODOTTI FINITI IN  MATERIE PLASTICHE E GOMMA E SERVIZI DI LAVORAZIONE C | PRODOTTI FINITI | IGIENE PERSONALE | APPLICAZIONI A ELEVATA TECNOLOGIA INDUSTRIA AEROSPAZIALE | APPLICAZIONI DOMESTICHE | ARREDAMENTO E MOBILI | PRODOTTI PER IL TEMPO LIBERO (COMPRESA VALIGERIA) | CASALINGHI | APPLICAZIONI INDUSTRIALI E AGRICOLE | AGRICOLTURA E ORTICOLTURA | COMPONENTI INDUSTRIALI | FORNITURA DI LAVORAZIONI PER CONTO TERZI | STAMPAGGIO A INIEZIONE",
CHINAFLUOROPOLYMER,https://dp-plast.fieramilano.it/exhibitor/463,https://dp-plast.fieramilano.it/exhibitor/463,"B2506/2507, Xianjin Taoci Innovation Valley New and High-Tech Zone, Zibo",255086,Shandong Province,,,China,+86 533 3787198,andy@chinafluoropolymer.com,http://www.chinafluoropolymer.com/,11,D48,,,,,"FLUORURO DI POLIVINILIDENE (PVDF) | ALTRI FLUOROPOLIMERI | POLITETRAFLUORETILENE (PTFE) | POLICLOROTRIFLUOROETILENE (PCTFE) | SEMILAVORATI, LASTRE E BLOCCHI | BARRE E TUBI | TUBAZIONI, RIGIDE E FLESSIBILI E CONDOTTE | FILM TRASPARENTI, FOGLIE E LASTRE-NASTRI | NASTRI IN PTFE | ALTRI SEMILAVORATI E PRODOTTI DI FINITURA | INDUSTRIE CHIMICHE | COMPONENTI INDUSTRIALI | EDILIZIA E COSTRUZIONE | FLUOROPOLIMERI | MATERIE PRIME, RIGENERATE E COMPOSITI | SEMILAVORATI E PRODOTTI DI FINITURA | FORNITORI DI SEMILAVORATI O PRODOTTI FINITI IN  MATERIE PLASTICHE E GOMMA E SERVIZI DI LAVORAZIONE C | APPLICAZIONI INDUSTRIALI E AGRICOLE","Shandong Hengyi New Material Technology Co., Ltd. (HENGYI) è un fornitore leader a livello globale di materiali fluoropolimerici ad alte prestazioni. Offriamo una gamma completa di prodotti, dalle resine FEP, PTFE, PVDF, PFA, ETFE e PCTFE ai semilavorati come lastre, barre, tubi, pellicole e componenti lavorati su misura."
LINKASON,https://dp-plast.fieramilano.it/exhibitor/464,https://dp-plast.fieramilano.it/exhibitor/464,"N.235, Shangnan East Road, Shajing Bao’an District",518104,"Shenzhen, Guangdong",,,China,+86 13612954498,13612954498@163.com,http://www.linkasontech.com,11,D28,,,,,"ALTRI ADDITIVI E AUSILIARI | CARICHE E RIEMPITIVI MINERALI | ALTRI ADDITIVI E AUSILIARI DI PROCESSO | MATERIE PRIME, RIGENERATE E COMPOSITI | CARICHE E RINFORZI","Founded in 2006, Linkason Tech Co., Ltd. is a leading comprehensive enterprise specializing in the R&D, production and sales of non-metallic mineral powders, with general taxpayer qualification. The company focuses on the R&D, manufacturing and marketing of core products including inorganic flame-retardant synergists, high-efficiency eco-friendly PVC flame retardants, and talc powder.
 With the wide application of flame-retardant plastics, surging demand for flame retardants and increasingly stringent global environmental standards, the company has established in-depth cooperation with a number of domestic universities and research institutes. Leveraging high-tech surface treatment and nanometer modification technologies, we have successfully developed LHX-999 (a new inorganic powder flame retardant) and LHX-HB-01 (a special flame-retardant synergist for PVC). These pioneering technologies are the first of its kind in China and lead the world, with products exported to Europe, America and global markets.
 We bring together an experienced professional team in management, R&D and marketing. We adhere to the people-oriented philosophy that ""employees are our greatest asset"", uphold the spirit of ""integrity and dedication, excellence and innovation"", and follow the mission of ""win-win cooperation, creating value for customers, employees and society"".
 At present, Linkason products are sold across China, Southeast Asia, Europe and the United States. Going forward, we will continue"
SINTD,https://dp-plast.fieramilano.it/exhibitor/465,https://dp-plast.fieramilano.it/exhibitor/465,"N.108, Industrial North Ave, Xiaolan",528415,"Zhongshan, Guangdong",,,China,+86 13925382258,td2@sintd.com,http://www.sintdzs.com,22,D47,,,,,"ATTREZZATURE PER RIDUZIONE DIMENSIONALE (FRANTUMATORI, TRITURATORI, GRANULATORI) | SELEZIONATRICI | ATTREZZATURE PER LA PREPARAZIONE E IL RICICLAGGIO, ALTRE | MACCHINE PER SOFFIAGGIO DI  MATERIE PLASTICHE, ALTRE | MACCHINE A INIEZIONE, ALTRE | SILOS E DISPOSITIVI DI SCARICO SILOS | ATTREZZATURE DI DOSAGGIO | CONVOGLIATORI E SISTEMI DI TRASPORTO DI POLVERI E GRANULI (ESCLUSI CARRELLI E CARRELLI ELEVATORI) | ESSICCATORI/DEUMIDIFICATORI PER MATERIALI IN MASSA | REFRIGERATORI D'ACQUA | UNITÀ DI RISCALDAMENTO E RAFFREDDAMENTO PER STAMPI E FILIERE | SEPARATORI DI METALLI | ATTREZZATURE AUSILIARIE PER LA LAVORAZIONE DI  MATERIE PLASTICHE E GOMMA, ALTRE | APPARECCHIATURE DI PESATURA DI PRECISIONE | MISCELATORI, ALTRI | MACCHINE E ATTREZZATURE PER LA PREPARAZIONE E IL RICICLAGGIO DELLE MATERIE PLAS","Taida Plastic Technologies (Zhongshan) S.r.l. è stata fondata nel 2008 nel Guangdong, Cina, e nel 2011 ha aperto una filiale a Wuhu, nell’Anhui. Ad oggi, SINTD conta più di 200 dipendenti e una superficie totale di stabilimenti produttivi superiore a 50.000 metri quadrati. SINTD si dedica da sempre alla ricerca, sviluppo e produzione di sistemi e apparecchiature intelligenti per la lavorazione della plastica. Finora abbiamo realizzato tre sistemi integrati: sistema IoT intelligente, sistema di trasporto centralizzato e progettazione completa di impianti elettrici, idrici e gassosi per stabilimenti industriali, oltre a sei linee di prodotti: essiccazione e deumidificazione, alimentazione e trasporto, miscelazione e dosaggio, riscaldamento e raffreddamento, granulazione e riciclo, manipolatori intelligenti. Forniamo ai clienti soluzioni intelligenti complete per interi stabilimenti e garantiamo la relativa messa in opera in loco. SINTD ha ottenuto numerosi certificati e riconoscimenti autorevoli, tra cui lo status di Impresa Alta Tecnologia, Marchio Noto Nazionale Cinese e Marchio Famoso della Provincia del Guangdong. I nostri prodotti sono esportati in oltre 130 Paesi e aree del mondo, tra cui Cina continentale, Taiwan, Hong Kong, Regno Unito, Stati Uniti, Australia, Brasile, Turchia, Russia e tutti i mercati del Sud-est asiatico. Seguendo il valore fondamentale di «integrità e sostenibilità», tutto il personale SINTD lavora secondo standard elevati per realizzare apparecchiat"
BECHTON,https://dp-plast.fieramilano.it/exhibitor/466,https://dp-plast.fieramilano.it/exhibitor/466,"No.206, Jifu Road, Fenghuang Town, Zhangjiagang  City, Suzhou City, Jiangsu Province",215600,Zhang Jia Gang,,,China,+86 18018197733,leo_bechton@163.com,http://www.bechton.com,13,U26,,,,,ESTRUSORI BIVITE | IMPIANTI D'ESTRUSIONE PER TUBI E PROFILI | FILIERE D'ESTRUSIONE | ESTRUSORI E IMPIANTI D'ESTRUSIONE PER  MATERIE PLASTICHE E GOMMA | MACCHINE E ATTREZZATURE PER L'INDUSTRIA DELLE MATERIE PLASTICHE E DELLA GOMMA | STAMPI E FILIERE PER  MATERIE PLASTICHE E GOMMA,
HOPO MS MOULD,https://dp-plast.fieramilano.it/exhibitor/467,https://dp-plast.fieramilano.it/exhibitor/467,"Qingfeng Road, Xinqian Industrial Zone, Huangyan",318020,"Taizhou City, Zhejiang",,,China,+86 576 84050878,admin@china-hopo.com,http://www.hopomould.com,22,D42,,,,,"STAMPI, ALTRI | STAMPI E FILIERE PER  MATERIE PLASTICHE E GOMMA | MACCHINE E ATTREZZATURE PER L'INDUSTRIA DELLE MATERIE PLASTICHE E DELLA GOMMA","HOPO MOULD è un'azienda high-tech specializzata nella progettazione e produzione di stampi per iniezione e parti in plastica, fondata nel 2012. Con oltre 60 dipendenti e uno stabilimento di 6000 m², forniamo soluzioni complete per componenti automobilistici, elettrodomestici e industriali, servendo marchi globali come PIAGGIO, HONDA e Panasonic. I nostri stampi di precisione (tolleranza ±0.05mm) sono certificati ISO9001, con una durata di vita prolungata e un servizio post-vendita globale, supportando clienti in Italia, Russia, Brasile e altri paesi."
