nome,url,url_canonical,indirizzo,cap,citta,provincia,regione,paese,telefono,email,sito_web,padiglione,stand,coespositore,espositore_principale,partita_iva,marchi,categorie,descrizione
FLUORINE,https://dp-plast.fieramilano.it/exhibitor/671,https://dp-plast.fieramilano.it/exhibitor/671,"N. 5 Weiyi Road, Shangyu",312300,"Shaoxing, Zhejiang",,,China,+86 18668076105,chengchen@flurine.com,http://www.flurine.com,11,C67,,,,,"FLUORURO DI POLIVINILIDENE (PVDF) | ALTRI FLUOROPOLIMERI | POLITETRAFLUORETILENE (PTFE) | FLUOROELASTOMERI | FLUOROPOLIMERI | MATERIE PRIME, RIGENERATE E COMPOSITI | ELASTOMERI","Fluorine Company è un produttore leader di fluoropolimeri PTFE, PVDF, PFA e fluoroelastomeri FKM e FFKM."
LICPLAS,https://dp-plast.fieramilano.it/exhibitor/672,https://dp-plast.fieramilano.it/exhibitor/672,"N. 8 Shihai Street, Hi-Tech Development Zone",264209,"Weihai City, Shandong Province",,,China,+86 631 5696087,licplas@licplas.com,http://www.licplas.com,11,C37,,,,,"POLIETILENE BASSA DENSITA' (LDPE) | POLIETILENE LINEARE BASSA DENSITA' (LLDPE) | POLIETILENE ALTA DENSITA' (HDPE) | POLIETILENE RETICOLATO (XLPE) | ALTRE POLIOLEFINE | POLIETERETERCHETONE (PEEK) | POLISULFONE (PSU) | ELASTOMERI TERMOPLASTICI (TPE) | ALTRI ELASTOMERI | MASTERBATCH COLORANTI | MASTERBATCH MODIFICANTI | TUBAZIONI, RIGIDE E FLESSIBILI E CONDOTTE | EDILIZIA E COSTRUZIONE | POLIOLEFINICHE | MATERIE PRIME, RIGENERATE E COMPOSITI | ALTRE MATERIE PLASTICHE | ELASTOMERI | PIGMENTI, COLORANTI E MASTERBATCH | SEMILAVORATI E PRODOTTI DI FINITURA | FORNITORI DI SEMILAVORATI O PRODOTTI FINITI IN  MATERIE PLASTICHE E GOMMA E SERVIZI DI LAVORAZIONE C | APPLICAZIONI INDUSTRIALI E AGRICOLE",
JIACHEN MOULD,https://dp-plast.fieramilano.it/exhibitor/673,https://dp-plast.fieramilano.it/exhibitor/673,"East Gate, N. 8 Kangzhuang Rd. West Industrial Zone, Huangyan",318020,"Taizhou, Zhejiang Province",,,China,+86 576 84217630,sales@jiachnmould.com,http://www.jiachenmould.com,22,C71,,,,,"SISTEMI A CANALI CALDI | STAMPI, ALTRI | ELEMENTI NORMALIZZATI PER STAMPI | STAMPI PER INIEZIONE/COMPRESSIONE | STAMPI PER SOFFIAGGIO | STAMPI PER TERMOFORMATURA | SERVIZI DI FABBRICAZIONE E PROCESSO | RICERCA E SVILUPPO | STAMPI E FILIERE PER  MATERIE PLASTICHE E GOMMA | MACCHINE E ATTREZZATURE PER L'INDUSTRIA DELLE MATERIE PLASTICHE E DELLA GOMMA | FABBRICAZIONE E PROCESSO | SERVIZI DI CONSULENZA E ORGANIZZAZIONI PER IL SETTORE DELLE MATERIE PLASTICHE E DELLA GOMMA",
KETONG PLASTIC,https://dp-plast.fieramilano.it/exhibitor/674,https://dp-plast.fieramilano.it/exhibitor/674,"N.11, Hongbinroad, Yuhong District",110000,"Shenyang City, Liaoning Province",,,China,+86 024 89362385,ketong@syketong.com,http://www.ketongplas.com,11,D51,,,,,"COPOLIMERI | POLIFENILENOSSIDO (PPO) | ELASTOMERI TERMOPLASTICI (TPE) | ADESIVIZZANTI | ALTRI ADDITIVI E AUSILIARI | ALTRI RINFORZI NON FIBROSI | CARICHE E RIEMPITIVI MINERALI | RINFORZI IN VETRO, FIBRE E SFERE | RINFORZI IN VETRO, STUOIE | ALTRI RINFORZI IN FIBRE | POLIAMMIDICHE | MATERIE PRIME, RIGENERATE E COMPOSITI | ALTRE MATERIE PLASTICHE | ELASTOMERI | ALTRI ADDITIVI E AUSILIARI DI PROCESSO | CARICHE E RINFORZI",
CCY MOULD,https://dp-plast.fieramilano.it/exhibitor/675,https://dp-plast.fieramilano.it/exhibitor/675,"N.20 Chaoyuan Rd, Beicheng Street, Huangyan",,"Taizhou, Zhejiang",,,China,+86 576 84832988,mail@cnpipingmould.com,http://www.cnpipingmould.com,13,V35,,,,,"MACCHINE A INIEZIONE PER TERMOPLASTICI OLTRE 10000 KN DI FORZA DI CHIUSURA | MACCHINE A INIEZIONE PER TERMOPLASTICI FINO A 250 KN DI FORZA DI CHIUSURA | MACCHINE A INIEZIONE PER TERMOPLASTICI DA 4000 KN FINO A 10000 KN DI FORZA DI CHIUSURA | MACCHINE A INIEZIONE PER TERMOPLASTICI DA 250 KN FINO A 1000 KN DI FORZA DI CHIUSURA | MACCHINE A INIEZIONE PER TERMOPLASTICI DA 1000 KN FINO A 4000 KN DI FORZA DI CHIUSURA | SISTEMI A CANALI CALDI | STAMPI, ALTRI | STAMPI PER INIEZIONE/COMPRESSIONE | STAMPI PER TERMOFORMATURA | MACCHINE A INIEZIONE PER  MATERIE PLASTICHE E GOMMA | MACCHINE E ATTREZZATURE PER L'INDUSTRIA DELLE MATERIE PLASTICHE E DELLA GOMMA | STAMPI E FILIERE PER  MATERIE PLASTICHE E GOMMA",CCY are specialized in pipe fitting moulds manufacturing. PPH pipe fitting molds; PPSU fitting moulds; PPR fitting moulds; PE fitting moulds; PVC fitting moulds.
ZHONGYUNTECH,https://dp-plast.fieramilano.it/exhibitor/676,https://dp-plast.fieramilano.it/exhibitor/676,"N.777, Dongfang Road, New & Hi-Tech Industrial  Development Zone",261061,"Weifang City, Shandong Province",,,China,+86 536 2225522,sales@zhongyuntech.com,http://www.zhongyuntech.com,13,U33,,,,,IMPIANTI D'ESTRUSIONE PER TUBI E PROFILI | IMPIANTI D'ESTRUSIONE PER RIVESTIMENTO DI TUBI E CAVI | FILIERE D'ESTRUSIONE | ESTRUSORI E IMPIANTI D'ESTRUSIONE PER  MATERIE PLASTICHE E GOMMA | MACCHINE E ATTREZZATURE PER L'INDUSTRIA DELLE MATERIE PLASTICHE E DELLA GOMMA | STAMPI E FILIERE PER  MATERIE PLASTICHE E GOMMA,
FIN DIEMME,https://dp-plast.fieramilano.it/exhibitor/677,https://dp-plast.fieramilano.it/exhibitor/677,Viale Della Reppubblica 46,50050,GAMBASSI TERME,FI,Toscana,Italy,+39 0571 668114,phil@fin-diemme.com,http://fin-diemme.com,13,F14,,,,,"IMPIANTI DI RICICLAGGIO | TERMOFORMATRICI | MACCHINE PER LAVORAZIONE SECONDARIA, ALTRE | IMPIANTI DI ACCOPPIAMENTO | IMPIANTI DI SPALMATURA | ATTREZZATURE DI PRETRATTAMENTO SUPERFICIALE | LAMINAZIONE | ALTRE OPERAZIONI DI POST-FINITURA | AUTOMAZIONE, ROBOTICA E INFORMATICA | GARANZIA DI QUALITA' | RICERCA E SVILUPPO | MACCHINE E ATTREZZATURE PER LA PREPARAZIONE E IL RICICLAGGIO DELLE MATERIE PLASTICHE E DELLA GOMMA | MACCHINE E ATTREZZATURE PER L'INDUSTRIA DELLE MATERIE PLASTICHE E DELLA GOMMA | MACCHINE PER LAVORAZIONE SECONDARIA DI  MATERIE PLASTICHE E GOMMA | MACCHINE E IMPIANTI PER FINITURA, DECORAZIONE, STAMPA E E MARCATURA DI PRODOTTI IN MATERIE PLASTICHE | ATTREZZATURE AUSILIARIE PER LA LAVORAZIONE DI  MATERIE PLASTICHE E GOMMA | FORNITORI DI OPERAZIONI POST-FINITURA | FORNITORI DI ",
SNE SCREW,https://dp-plast.fieramilano.it/exhibitor/678,https://dp-plast.fieramilano.it/exhibitor/678,"N. 225 Tengying Road, Heng Liang Street Lu He District",211515,"Nanjing City, Jiangsu Province",,,China,+86 15251861703,stacy@snextruder.com,http://www.snextruder.com,13,V20,,,,,"IMPIANTI D'ESTRUSIONE PER FILM SOFFIATO | IMPIANTI D'ESTRUSIONE PER FILM-FOGLIE-LASTRE | ESTRUSORI BIVITE | IMPIANTI D'ESTRUSIONE PER MONO E MULTIFILAMENTI | IMPIANTI D'ESTRUSIONE PER ACCOPPIAMENTO E SPALMATURA | IMPIANTI D'ESTRUSIONE PER GOMMA | IMPIANTI D'ESTRUSIONE PER COMPOUND | IMPIANTI D'ESTRUSIONE, ALTRI | TRASPORTATORI A VITE | VITI DI PLASTIFICAZIONE | CAMERE DI PLASTIFICAZIONE | ELEMENTI RISCALDANTI PER CAMERE E CILINDRI DI PLASTIFICAZIONE / RESISTENZE / IRRADIATORI | PARTI E COMPONENTI DI MACCHINE PER MATERIE PLASTICHE E GOMMA, ALTRE | ESTRUSORI E IMPIANTI D'ESTRUSIONE PER  MATERIE PLASTICHE E GOMMA | MACCHINE E ATTREZZATURE PER L'INDUSTRIA DELLE MATERIE PLASTICHE E DELLA GOMMA | ATTREZZATURE AUSILIARIE PER LA LAVORAZIONE DI  MATERIE PLASTICHE E GOMMA | PARTI E COMPONENTI DI MAC",
NEXITAL,https://dp-plast.fieramilano.it/exhibitor/679,https://dp-plast.fieramilano.it/exhibitor/679,Via Dell'Artigianato 26/28,59013,MONTEMURLO,PO,Toscana,Italy,+39 0574 65341,info@nexital.it,http://.,9,A119,,,,,"POLIETILENE BASSA DENSITA' (LDPE) | POLIETILENE LINEARE BASSA DENSITA' (LLDPE) | POLIETILENE ALTA DENSITA' (HDPE) | COPOLIMERI DI POLIPROPILENE (PPCP) | POLIETILENE MEDIA DENSITA' (MDPE) | OMOPOLIMERI DI POLIPROPILENE (PPHP) | POLIOLEFINICHE | MATERIE PRIME, RIGENERATE E COMPOSITI",
SKR,https://dp-plast.fieramilano.it/exhibitor/680,https://dp-plast.fieramilano.it/exhibitor/680,"205 Room, N.2 Meilin Street, Jiangning District",210000,Nanjing,,,China,+86 13914736564,info@skrscrew.com,http://www.skrscrew.com,13,V28,,,,,"PELLETTIZZATORI | IMPIANTI DI MESCOLAZIONE | IMPIANTI DI RICICLAGGIO | ESTRUSORI BIVITE | ESTRUSORI, ALTRI | IMPIANTI D'ESTRUSIONE PER GOMMA | IMPIANTI D'ESTRUSIONE PER COMPOUND | FILIERE D'ESTRUSIONE | VITI DI PLASTIFICAZIONE | CAMERE DI PLASTIFICAZIONE | UGELLI | ELEMENTI RISCALDANTI PER CAMERE E CILINDRI DI PLASTIFICAZIONE / RESISTENZE / IRRADIATORI | PARTI E COMPONENTI DI MACCHINE PER MATERIE PLASTICHE E GOMMA, ALTRE | ESTRUSIONE | CAMBIAFILTRI | MACCHINE E ATTREZZATURE PER LA PREPARAZIONE E IL RICICLAGGIO DELLE MATERIE PLASTICHE E DELLA GOMMA | MACCHINE E ATTREZZATURE PER L'INDUSTRIA DELLE MATERIE PLASTICHE E DELLA GOMMA | ESTRUSORI E IMPIANTI D'ESTRUSIONE PER  MATERIE PLASTICHE E GOMMA | STAMPI E FILIERE PER  MATERIE PLASTICHE E GOMMA | PARTI E COMPONENTI DI MACCHINE  PER MATERIE PLA","NANJING SIKERUN MACHINERY CO.,LTD-SKR: VITI PER GRANULATORI Marchi partner: Coperion, CPM, Leistritz, KERKE, J-well, USEON, Cenmeng, COWIN. Albero vite/Cilindro estrusore/Albero scanalato/ ZSK-MC/ZSE/LSB/TSK/MP65/TEX/SFV/ZME/SME/TME/ZE/TEM/TEK-HS/FED-MTS/TM-W, ecc. Materiali: Vite in acciaio rapido W6MO5Cr4V2/38CrMoAla/WR15/Hastelloy/Nichel 60, ecc. Processo di lavorazione: Tempra ad alta temperatura, tempra e rinvenimento, nitrurazione, cromatura, spruzzatura di tungsteno, spruzzatura ceramica Al₂O₃, rivestimento laser, ecc."
LIXUAN,https://dp-plast.fieramilano.it/exhibitor/681,https://dp-plast.fieramilano.it/exhibitor/681,"6th Floor, Building 1, N. 1000, Zhenchen Road,  Baoshan District",200444,Shanghai,,,China,+86 18616771985,2966723096@qq.com,http://www.songhuxr.com,13,V27,,,,,"ATTREZZATURE PER RIDUZIONE DIMENSIONALE (FRANTUMATORI, TRITURATORI, GRANULATORI) | IMPIANTI DI RICICLAGGIO | FRESATRICI | TRASPORTATORI A VITE | ATTREZZATURE AUSILIARIE PER LA LAVORAZIONE DI  MATERIE PLASTICHE E GOMMA, ALTRE | LAME E COLTELLI PER MACCHINE | PARTI E COMPONENTI DI MACCHINE PER MATERIE PLASTICHE E GOMMA, ALTRE | COMPONENTI INDUSTRIALI | MACCHINE E ATTREZZATURE PER LA PREPARAZIONE E IL RICICLAGGIO DELLE MATERIE PLASTICHE E DELLA GOMMA | MACCHINE E ATTREZZATURE PER L'INDUSTRIA DELLE MATERIE PLASTICHE E DELLA GOMMA | MACCHINE PER LAVORAZIONE SECONDARIA DI  MATERIE PLASTICHE E GOMMA | ATTREZZATURE AUSILIARIE PER LA LAVORAZIONE DI  MATERIE PLASTICHE E GOMMA | PARTI E COMPONENTI DI MACCHINE  PER MATERIE PLASTICHE E GOMMA | APPLICAZIONI INDUSTRIALI E AGRICOLE | FORNITORI DI SEMILAVO","Allora, la Shanghai Lixuan Industrial Co., Ltd. è stata fondata nel 2007 e ha sede a Shanghai. Siamo un produttore specializzato in trituratori per PVC e macine per PE e PVC.
 Abbiamo un team di ricerca e sviluppo professionale, in grado di rispondere rapidamente a diverse esigenze e di offrire servizi OEM completi. Dal 2013 esportiamo i nostri prodotti in molti mercati esteri, come Vietnam, Uzbekistan, Europa e altri. Grazie all'alta qualità dei nostri prodotti e al servizio professionale, riceviamo sempre grandi elogi dai clienti.
 I nostri trituratori sono versatili: possono lavorare tanti materiali diversi, come profilati plastica-acciaio, pannelli per controsoffitti, pannelli murali, legno sintetico e profili vari, con una capacità che va da 0,5 a 2 tonnellate all'ora. Le nostre macine, invece, sono progettate per vari materiali in PVC e PE. Siamo sempre impegnati a innovare il nostro processo produttivo per offrire a ogni cliente soluzioni più efficienti e su misura."
NEWTOP,https://dp-plast.fieramilano.it/exhibitor/682,https://dp-plast.fieramilano.it/exhibitor/682,"Block A-03, Wanquan Light Industry Area Pingyang County",325400,Zhejiang,,,China,+86 13967786185,kitty@debaochina.com,http://www.debaochina.com,22,C41,,,,,"IMPIANTI DI RICICLAGGIO | PRESSE, ALTRE | MACCHINE PER ESTRUSIONE/SOFFIAGGIO | MACCHINE A INIEZIONE PER TERMOPLASTICI FINO A 250 KN DI FORZA DI CHIUSURA | MACCHINE PER L'INDUSTRIA DEGLI PNEUMATICI | MACCHINE PER FORMATURA, RIEMPIMENTO E SIGILLATURA | SALDATRICI, ALTRE | IMPIANTI DI ACCOPPIAMENTO | REGGIATRICI | CONFEZIONATRICI | STAMPI PER SOFFIAGGIO | REFRIGERATORI D'ACQUA | SISTEMI DI BLOCCAGGIO STAMPI E ALLACCIAMENTI DI POTENZA | SENSORI DI ALLINEAMENTO E CENTRATURA | APPARECCHIATURE DI PESATURA DI PRECISIONE | MACCHINE E ATTREZZATURE PER LA PREPARAZIONE E IL RICICLAGGIO DELLE MATERIE PLASTICHE E DELLA GOMMA | MACCHINE E ATTREZZATURE PER L'INDUSTRIA DELLE MATERIE PLASTICHE E DELLA GOMMA | PRESSE PER  MATERIE PLASTICHE E GOMMA | MACCHINE PER SOFFIAGGIO DI  MATERIE PLASTICHE | MACCHINE A ",
NARI,https://dp-plast.fieramilano.it/exhibitor/683,https://dp-plast.fieramilano.it/exhibitor/683,"N. 3, Gongmao Street, Bowang District",243131,"Ma'Anshan City, Anhui Province",,,China,+86 13721236496,maike@maidecal.com,http://www.maidecal.com,13,U31,,,,,"ATTREZZATURE PER RIDUZIONE DIMENSIONALE (FRANTUMATORI, TRITURATORI, GRANULATORI) | PELLETTIZZATORI | IMPIANTI DI RICICLAGGIO | ATTREZZATURE PER LA PREPARAZIONE E IL RICICLAGGIO, ALTRE | ESTRUSORI BIVITE | MACCHINE PER TAGLIO LONGITUDINALE E PELATURA | SILOS E DISPOSITIVI DI SCARICO SILOS | REFRIGERATORI D'ACQUA | VITI DI PLASTIFICAZIONE | CILINDRI DI PLASTIFICAZIONE | LAME E COLTELLI PER MACCHINE | PARTI E COMPONENTI DI MACCHINE PER MATERIE PLASTICHE E GOMMA, ALTRE | VERNICIATURA E METALLIZZAZIONE | MISCELATORI DI TIPO CONTINUO PER SOLIDI | MISCELATORI DI TIPO DISCONTINUO PER SOLIDI | MACCHINE E ATTREZZATURE PER LA PREPARAZIONE E IL RICICLAGGIO DELLE MATERIE PLASTICHE E DELLA GOMMA | MACCHINE E ATTREZZATURE PER L'INDUSTRIA DELLE MATERIE PLASTICHE E DELLA GOMMA | ESTRUSORI E IMPIANTI D'ESTR","NARI CUTTING TOOLS & MOLDS CO., LTD. è un produttore leader e fornitore globale specializzato in soluzioni di taglio industriale di alta precisione e macchinari avanzati per il riciclaggio. Grazie a una consolidata esperienza tecnica, offriamo una gamma completa di lame industriali ad alte prestazioni, tra cui: Utensili di Precisione: Lame circolari, coltelli per granulatori e frantoi, inserti per trituratori pesanti, lame per cesoie e coltelli sagomati speciali progettati per applicazioni complesse. Macchinari per il Riciclaggio: Progettiamo e forniamo inoltre attrezzature robuste per il riciclaggio, inclusi mulini granulatori ad alta efficienza e potenti trituratori monoalbero e bialbero. I nostri prodotti sono realizzati con materiali di prima qualità come SKD-11 (D2), HSS e Carburo di Tungsteno, abbinati a trattamenti termici sottovuoto avanzati per garantire un'eccezionale resistenza all'usura e una lunga durata operativa. Che abbiate bisogno di parti di ricambio standard o di macchinari completi per il trattamento dei rifiuti, NARI si impegna a fornire soluzioni su misura che ottimizzino l'efficienza produttiva e riducano i costi operativi per le industrie della plastica, della gomma e dell'imballaggio in tutto il mondo."
JINGYOU CHEM,https://dp-plast.fieramilano.it/exhibitor/684,https://dp-plast.fieramilano.it/exhibitor/684,"Rm1105 Haihua Plaza, N. 658, Jianguo North Road",310004,Hangzhou,,,China,+86 571 87211402,w.zeng@jingyouchem.com,http://www.jingyouchem.com,11,D47,,,,,"FLUORURO DI POLIVINILIDENE (PVDF) | FLUOROELASTOMERI | PIGMENTI IN POLVERE | MASTERBATCH RITARDANTI DI FIAMMA | MASTERBATCH MODIFICANTI | STABILIZZANTI | LUBRIFICANTI | RETICOLANTI | POLIMERIZZANTI | ESPANDENTI | ADESIVIZZANTI | DISTACCANTI | ALTRI ADDITIVI E AUSILIARI | FLUOROPOLIMERI | MATERIE PRIME, RIGENERATE E COMPOSITI | ELASTOMERI | PIGMENTI, COLORANTI E MASTERBATCH | ALTRI ADDITIVI E AUSILIARI DI PROCESSO",
SHOU SU,https://dp-plast.fieramilano.it/exhibitor/685,https://dp-plast.fieramilano.it/exhibitor/685,"Building 18, 19 Lanhua Road, Pukou District",211800,"Nanjing, Jiangsu",,,China,+86 13851736850,yw@njsspeek.com,http://www.shousupeek.com,11,D56,,,,,"POLIETERETERCHETONE (PEEK) | POLIFENILENSOLFURO (PPS) | POLIIMMIDE (PI) | POLIETERIMMIDE (PEI) | SEMILAVORATI, LASTRE E BLOCCHI | BARRE E TUBI | TUBAZIONI, RIGIDE E FLESSIBILI E CONDOTTE | ESTRUSIONE | STAMPAGGIO A INIEZIONE | ALTRE MATERIE PLASTICHE | MATERIE PRIME, RIGENERATE E COMPOSITI | SEMILAVORATI E PRODOTTI DI FINITURA | FORNITORI DI SEMILAVORATI O PRODOTTI FINITI IN  MATERIE PLASTICHE E GOMMA E SERVIZI DI LAVORAZIONE C | FORNITURA DI LAVORAZIONI PER CONTO TERZI","Nanjing Shousu Engineering Plastics Co., Ltd. è un'azienda produttrice specializzata nello stampaggio a iniezione, estrusione, compressione e lavorazione CNC di tecnopolimeri, come PEEK, PPS, PEI, ecc.
 L'azienda dispone di presse a iniezione, presse a compressione, torni CNC di alta precisione, centri di lavoro CNC e altre attrezzature meccaniche.
 Pertanto, siamo in grado di produrre profili in PEEK (barre, lastre, tubi, filamenti e capillari) e di realizzare semilavorati e pezzi finiti su disegno, utilizzando le nostre attrezzature."
DEKUMA,https://dp-plast.fieramilano.it/exhibitor/686,https://dp-plast.fieramilano.it/exhibitor/686,"Yinzhu Road, Zhouwu Industrial Park Dongcheng District",523118,"Dongguan, Guangdong",,,China,+86 769 22667200,info@dekuma.com,http://en.dekuma.com,13,V23,,,,,"ESTRUSORI MONOVITE | ESTRUSORI BIVITE | IMPIANTI D'ESTRUSIONE PER TUBI E PROFILI | PRESSE, ALTRE | MACCHINE A INIEZIONE PER GOMMA | ESTRUSORI E IMPIANTI D'ESTRUSIONE PER  MATERIE PLASTICHE E GOMMA | MACCHINE E ATTREZZATURE PER L'INDUSTRIA DELLE MATERIE PLASTICHE E DELLA GOMMA | PRESSE PER  MATERIE PLASTICHE E GOMMA | MACCHINE A INIEZIONE PER  MATERIE PLASTICHE E GOMMA",
BLT STAMPI,https://dp-plast.fieramilano.it/exhibitor/687,https://dp-plast.fieramilano.it/exhibitor/687,Strada Del Francese 87/14,10156,TORINO,TO,Piemonte,Italy,+39 011 4704445,commerciale@bltstampi.it,http://www.bltstampi.it,24,C123,,,,,"STAMPI, ALTRI | STAMPI PER INIEZIONE/COMPRESSIONE | STAMPAGGIO A INIEZIONE | ALTRE LAVORAZIONI MECCANICHE | RICONDIZIONAMENTO DI ATTREZZATURE E COMPONENTI | STAMPI E FILIERE PER  MATERIE PLASTICHE E GOMMA | MACCHINE E ATTREZZATURE PER L'INDUSTRIA DELLE MATERIE PLASTICHE E DELLA GOMMA | FORNITURA DI LAVORAZIONI PER CONTO TERZI | FORNITORI DI SEMILAVORATI O PRODOTTI FINITI IN  MATERIE PLASTICHE E GOMMA E SERVIZI DI LAVORAZIONE C | LAVORAZIONI SECONDARIE | RICOSTRUZIONE E RICONDIZIONAMENTO | SERVIZI DI CONSULENZA E ORGANIZZAZIONI PER IL SETTORE DELLE MATERIE PLASTICHE E DELLA GOMMA",
ZHENXIONG MACHINERY,https://dp-plast.fieramilano.it/exhibitor/688,https://dp-plast.fieramilano.it/exhibitor/688,"Daqiao Industry Zone, Anbu",521000,"Chaozhou, Guangdong",,,China,+86 768 5925023,380098151@qq.com,http://www.zxjixie.com,15,U48,,,,,TAGLIERINE | AVVOLGITORI-BOBINATORI | TAGLIERINE RIBOBINATRICI | MACCHINE PER LAVORAZIONE SECONDARIA DI  MATERIE PLASTICHE E GOMMA | MACCHINE E ATTREZZATURE PER L'INDUSTRIA DELLE MATERIE PLASTICHE E DELLA GOMMA,
FANLYPLAS,https://dp-plast.fieramilano.it/exhibitor/689,https://dp-plast.fieramilano.it/exhibitor/689,"J508, N.1080, Moyu Road, Anting",201805,"Jiading, Shanghai",,,China,+86 021 69895995,export@fanlyplas.com,http://www.fanlyplas.com,13,V29,,,,,"ATTREZZATURE PER RIDUZIONE DIMENSIONALE (FRANTUMATORI, TRITURATORI, GRANULATORI) | IMPIANTI D'ESTRUSIONE PER FILM-FOGLIE-LASTRE | ESTRUSORI MONOVITE | ESTRUSORI BIVITE | ESTRUSORI, ALTRI | IMPIANTI D'ESTRUSIONE PER TUBI E PROFILI | IMPIANTI D'ESTRUSIONE, ALTRI | FILIERE D'ESTRUSIONE | ATTREZZATURE DI DOSAGGIO | CONVOGLIATORI E SISTEMI DI TRASPORTO DI POLVERI E GRANULI (ESCLUSI CARRELLI E CARRELLI ELEVATORI) | REFRIGERATORI D'ACQUA | VITI DI PLASTIFICAZIONE | CILINDRI DI PLASTIFICAZIONE | CAMERE DI PLASTIFICAZIONE | MISCELATORI, ALTRI | MACCHINE E ATTREZZATURE PER LA PREPARAZIONE E IL RICICLAGGIO DELLE MATERIE PLASTICHE E DELLA GOMMA | MACCHINE E ATTREZZATURE PER L'INDUSTRIA DELLE MATERIE PLASTICHE E DELLA GOMMA | ESTRUSORI E IMPIANTI D'ESTRUSIONE PER  MATERIE PLASTICHE E GOMMA | STAMPI E F","FANLYPLAS SHANGHAI CO., LTD (precedentemente Dasu Machinery) è stata fondata nel 2005. Nel 2015 abbiamo lanciato il marchio Fanlyplas per il commercio internazionale. Siamo specializzati nella ricerca, progettazione e produzione di linee di estrusione per materie plastiche (fogli, lastre, film e profili), con stabilimenti a Haining e Chuzhou. La nostra produzione è rigorosamente controllata per rispettare i più alti standard di settore."
ASERT,https://dp-plast.fieramilano.it/exhibitor/690,https://dp-plast.fieramilano.it/exhibitor/690,Corso Novara 230/C,27029,VIGEVANO,PV,Lombardia,Italy,+39 0381 312500,info@asert.it,http://www.asert.it,22,C134,,,,,"MACCHINE PER STAMPA SU PRODOTTI IN PLASTICA E GOMMA | STAMPATRICI, ALTRE | MACCHINE E IMPIANTI PER FINITURA, DECORAZIONE, STAMPA E MARCATURA, ALTRE E LINEE DI CONFEZIONAMENTO | STAMPA | MACCHINE E IMPIANTI PER FINITURA, DECORAZIONE, STAMPA E E MARCATURA DI PRODOTTI IN MATERIE PLASTICHE | MACCHINE E ATTREZZATURE PER L'INDUSTRIA DELLE MATERIE PLASTICHE E DELLA GOMMA | FORNITORI DI OPERAZIONI POST-FINITURA | FORNITORI DI SEMILAVORATI O PRODOTTI FINITI IN  MATERIE PLASTICHE E GOMMA E SERVIZI DI LAVORAZIONE C",
TESAR,https://dp-plast.fieramilano.it/exhibitor/691,https://dp-plast.fieramilano.it/exhibitor/691,Via G. Garibaldi 12,21053,CASTELLANZA,VA,Lombardia,Italy,+39 0331 775662,info@tesar.it,http://www.tesar.it,24,A81,,,,,"CONTROLLI DI PROCESSO | ALTRE APPLICAZIONI INDUSTRIALI | INGEGNERIA DI PRODUZIONE | SERVIZI DI FABBRICAZIONE E PROCESSO | AUTOMAZIONE, ROBOTICA E INFORMATICA | GARANZIA DI QUALITA' | RICERCA E SVILUPPO | CONSULENZA COMMERCIALE E GENERALE | SERVIZI DI INFORMAZIONE | SERVIZI DI COMPUTER E SOFTWARE | ATTREZZATURE AUSILIARIE PER LA LAVORAZIONE DI  MATERIE PLASTICHE E GOMMA | MACCHINE E ATTREZZATURE PER L'INDUSTRIA DELLE MATERIE PLASTICHE E DELLA GOMMA | APPLICAZIONI INDUSTRIALI E AGRICOLE | FORNITORI DI SEMILAVORATI O PRODOTTI FINITI IN  MATERIE PLASTICHE E GOMMA E SERVIZI DI LAVORAZIONE C | FABBRICAZIONE E PROCESSO | SERVIZI DI CONSULENZA E ORGANIZZAZIONI PER IL SETTORE DELLE MATERIE PLASTICHE E DELLA GOMMA | SERVIZI COMMERCIALI E AMMINISTRATIVI","Da 35 anni TESAR accompagna le aziende manifatturiere nel complesso percorso di trasformazione digitale della fabbrica in ottica Industry 4.0 e Transizione 5.0.
 Tesar fornisce sistemi MES per la raccolta dei dati, la schedulazione, il controllo e la gestione della produzione oltre che della qualità dell’industria. Offre, inoltre, una suite completa di soluzioni tecnologicamente avanzate ed integrabili con qualsiasi sistema ERP e ambito industriale.
 Il Gruppo Tesar è a sua volta parte del gruppo Dylog Italia spa, società attiva nella progettazione, sviluppo e commercializzazione di software gestionali e servizi per imprese e professionisti."
IMI FABI,https://dp-plast.fieramilano.it/exhibitor/692,https://dp-plast.fieramilano.it/exhibitor/692,Viale dei Mille 68,20129,MILANO,MI,Lombardia,Italy,+39 0342 490311,info@imifabi.com,http://www.imifabi.com,9,D108,,,,,"CARICHE E RIEMPITIVI MINERALI | CARICHE E RINFORZI | MATERIE PRIME, RIGENERATE E COMPOSITI",
ZHETUO,https://dp-plast.fieramilano.it/exhibitor/693,https://dp-plast.fieramilano.it/exhibitor/693,"Jinyuan Road High-Tech Industrial Park Huangjinbu  Town, Yugan County",335100,"Shangrao City , Jiangxi Province",,,China,+86 15157792601,zhetuojx@163.com,http://www.zhetuojx.com,15,T49,,,,,"IMPIANTI D'ESTRUSIONE PER FILM-FOGLIE-LASTRE | ESTRUSORI MONOVITE | ESTRUSORI BIVITE | IMPIANTI D'ESTRUSIONE PER ACCOPPIAMENTO E SPALMATURA | IMPIANTI D'ESTRUSIONE PER COMPOUND | FILIERE D'ESTRUSIONE | VITI DI PLASTIFICAZIONE | CILINDRI DI PLASTIFICAZIONE | POLIETILENE BASSA DENSITA' (LDPE) | POLIETILENE LINEARE BASSA DENSITA' (LLDPE) | IMBALLAGGIO | TRASPORTI | AGRICOLTURA E ORTICOLTURA | ESTRUSIONE | PRODUZIONE DI FILM | ESTRUSORI E IMPIANTI D'ESTRUSIONE PER  MATERIE PLASTICHE E GOMMA | MACCHINE E ATTREZZATURE PER L'INDUSTRIA DELLE MATERIE PLASTICHE E DELLA GOMMA | STAMPI E FILIERE PER  MATERIE PLASTICHE E GOMMA | PARTI E COMPONENTI DI MACCHINE  PER MATERIE PLASTICHE E GOMMA | POLIOLEFINICHE | MATERIE PRIME, RIGENERATE E COMPOSITI | APPLICAZIONI DOMESTICHE | FORNITORI DI SEMILAVORATI O P",
XINLING INDUSTRIAL,https://dp-plast.fieramilano.it/exhibitor/694,https://dp-plast.fieramilano.it/exhibitor/694,"Unit 1303 , Qiancheng Center, N.5 Haicheng Road  Bao'an district",518102,Shenzhen,,,China,+86 0 18142664236,vivian@xinlinghk.com,http://www.xinlinghk.com,24,C127,,,,,STAMPI PER INIEZIONE/COMPRESSIONE | STAMPI E FILIERE PER  MATERIE PLASTICHE E GOMMA | MACCHINE E ATTREZZATURE PER L'INDUSTRIA DELLE MATERIE PLASTICHE E DELLA GOMMA,"Xinling Industrial Co., Ltd. (Shenzhen, 2006) specializes in mold design, manufacturing, injection molding, and assembly. We deliver 20+ one-stop projects annually (molding → laser engraving → printing → plating → electronics → APP → assembly → packaging). Main products: auto parts, connectors, home appliances, medical & electrical parts for overseas markets. Key capabilities: 70 employees | 350 molds/year | Mold up to 1500×1200mm | 15 tons | Precision ±0.01mm | Types: large, high-precision, 2K, overmold, thermoset, stack mold. Competitive pricing, on-time delivery, high quality, professional engineering & machining teams. Global partners welcome."
DAVIS-STANDARD,https://dp-plast.fieramilano.it/exhibitor/695,https://dp-plast.fieramilano.it/exhibitor/695,8725 West Higgins Road,60631,"Chicago, IL",,,United States of America,+1 860 5991010,info@davis-standard.com,http://www.davis-standard.com,13,J33 L34,,,,,"IMPIANTI D'ESTRUSIONE PER FILM SOFFIATO | IMPIANTI D'ESTRUSIONE PER FILM-FOGLIE-LASTRE | ESTRUSORI MONOVITE | ESTRUSORI BIVITE | ESTRUSORI, ALTRI | IMPIANTI D'ESTRUSIONE PER TUBI E PROFILI | IMPIANTI D'ESTRUSIONE PER ACCOPPIAMENTO E SPALMATURA | IMPIANTI D'ESTRUSIONE PER GOMMA | IMPIANTI D'ESTRUSIONE, ALTRI | TERMOFORMATRICI | AVVOLGITORI-BOBINATORI | TAGLIERINE RIBOBINATRICI | FILIERE D'ESTRUSIONE | SILICONICI | ESTRUSORI E IMPIANTI D'ESTRUSIONE PER  MATERIE PLASTICHE E GOMMA | MACCHINE E ATTREZZATURE PER L'INDUSTRIA DELLE MATERIE PLASTICHE E DELLA GOMMA | MACCHINE PER LAVORAZIONE SECONDARIA DI  MATERIE PLASTICHE E GOMMA | STAMPI E FILIERE PER  MATERIE PLASTICHE E GOMMA | ELASTOMERI | MATERIE PRIME, RIGENERATE E COMPOSITI",
