nome,url,url_canonical,indirizzo,cap,citta,provincia,regione,paese,telefono,email,sito_web,padiglione,stand,coespositore,espositore_principale,partita_iva,marchi,categorie,descrizione
URAI,https://dp-plast.fieramilano.it/exhibitor/227,https://dp-plast.fieramilano.it/exhibitor/227,Via Gaetano Donizetti 12/14,20090,ASSAGO,MI,Lombardia,Italy,+39 02 8923991,prodotti.chimici@urai.it,http://www.urai.it,9,A21 B22,,,,,"APPARECCHIATURE PER INVECCHIAMENTO ARTIFICIALE | APPARECCHIATURE PER MISURE E PROVE PER PROPRIETÀ REOLOGICHE | APPARECCHIATURE PER MISURE E PROVE PER PROPRIETÀ MECCANICHE E DINAMICHE | APPARECCHIATURE PER MISURE E PROVE PER PROPRIETÀ TERMICHE | APPARECCHIATURE PER CONTROLLI E PROVE, ALTRE | ALTRI COPOLIMERI | ALTRE | PIGMENTI IN POLVERE | LUBRIFICANTI | RETICOLANTI | ADESIVIZZANTI | ALTRI ADDITIVI E AUSILIARI | CARICHE E RIEMPITIVI MINERALI | MISCELATORI DI TIPO DISCONTINUO PER SOLIDI | MISCELATORI, ALTRI | CONTROLLI DI PROCESSO | ATTREZZATURE AUSILIARIE PER LA LAVORAZIONE DI  MATERIE PLASTICHE E GOMMA | MACCHINE E ATTREZZATURE PER L'INDUSTRIA DELLE MATERIE PLASTICHE E DELLA GOMMA | APPARECCHIATURE PER CONTROLLI E PROVE DI LABORATORIO | ACRILICHE | MATERIE PRIME, RIGENERATE E COMPOSITI | A","URAI è stata fondata nel 1948 da Armando Giuliani con l’obiettivo di fornire all’industria chimica italiana specialità chimiche, ingredienti innovativi e strumenti di laboratorio di elevata qualità. La Business Unit Plastica e Gomme, all’interno della Divisione Prodotti Chimici, fornisce materie prime, additivi, pigmenti e cariche, offrendo soluzioni dedicate per il mondo dei polimeri termoplastici e termoindurenti e supportando i clienti nelle applicazioni industriali. La nostra missione è garantire prodotti e servizi di alto livello, con un’assistenza tecnica e commerciale continua. Assicuriamo ai partner fornitori una copertura capillare del territorio nazionale grazie a una rete di venditori e agenti tecnicamente qualificati."
PLAS MEC,https://dp-plast.fieramilano.it/exhibitor/229,https://dp-plast.fieramilano.it/exhibitor/229,Via Europa 79,21015,LONATE POZZOLO,VA,Lombardia,Italy,+39 0331 301648,comm@plasmec.it,http://www.plasmec.it,13,F33 G26,,,,,"MACCHINE E ATTREZZATURE PER L'INDUSTRIA DELLE MATERIE PLASTICHE E DELLA GOMMA | MACCHINE E ATTREZZATURE PER LA PREPARAZIONE E IL RICICLAGGIO DELLE MATERIE PLASTICHE E DELLA GOMMA | IMPIANTI DI MESCOLAZIONE | MISCELATORI DI TIPO CONTINUO PER SOLIDI | MISCELATORI DI TIPO DISCONTINUO PER SOLIDI | MISCELATORI, ALTRI","PLAS MEC S.R.L. è un'azienda italiana riconosciuta a livello mondiale da quasi 60 anni quale leader nella produzione di impianti di miscelazione per PVC, materie plastiche, masterbatch, vernici in polvere, tecnopolimeri, ecc. Nel corso del tempo, ha ricevuto un'eccellente reputazione internazionale basata sulla qualità produttiva, l'affidabilità operativa e la capacità di progettare soluzioni personalizzate, adattate alle esigenze specifiche di ogni processo produttivo. Gli impianti PLAS MEC sono installati in oltre settanta paesi del mondo e sono apprezzati per la loro precisione, durata ed efficienti prestazioni. Gamma di produzione principale: IMPIANTO DI MISCELAZIONE ‘COMBIMIX HC’: combinazione di un miscelatore ad alta velocità con un raffreddatore ad alta efficienza, CONTAINER MIXER ‘TRR’: alternativa ideale ai tradizionali turbomiscelatori, adatto alla preparazione di masterbatch, pigmenti, tecnopolimeri e vernici in polvere. La possibilità di miscelare diverse ricette con un'unica macchina."
PLASTORE,https://dp-plast.fieramilano.it/exhibitor/230,https://dp-plast.fieramilano.it/exhibitor/230,Via Stradone del Dieci 25,45030,VILLAMARZANA,RO,Veneto,Italy,+39 0425 1666273,info@plastore.it,http://www.plastore.it,9,B108,,,,,"POLIMETILMETACRILATO (PMMA) | POLIAMMIDE 6 (PA 6) | POLIAMMIDE 66 (PA 66) | POLIBUTILENTEREFTALATO (PBT) | POLICARBONATO (PC) | POLIETILENE BASSA DENSITA' (LDPE) | POLIETILENE ALTA DENSITA' (HDPE) | COPOLIMERI DI POLIPROPILENE (PPCP) | OMOPOLIMERI DI POLIPROPILENE (PPHP) | COPOLIMERI DI STIRENE-ACRILONITRILE (SAN) | POLISTIRENE (GPPS, HIPS, EPS) | ACRILONITRILE-BUTADIENE-STIRENE (ABS) | ACRILONITRILE-STIRENE-ACRILATO (ASA) | POLIFENILENSOLFURO (PPS) | ACETALICHE (POM) | POLIFENILENOSSIDO (PPO) | ELASTOMERI TERMOPLASTICI (TPE) | ACRILICHE | MATERIE PRIME, RIGENERATE E COMPOSITI | POLIAMMIDICHE | POLIESTERI TERMOPLASTICI | POLIOLEFINICHE | STIRENICHE E COPOLIMERI A BASE DI STIRENE | ALTRE MATERIE PLASTICHE | ELASTOMERI",
RTECH ENGINEERING,https://dp-plast.fieramilano.it/exhibitor/231,https://dp-plast.fieramilano.it/exhibitor/231,Via della Concordia 66,21040,SUMIRAGO,VA,Lombardia,Italy,+39 0331 855018,commerciale@rtech-engineering.it,http://www.rtech-engineering.it,11,C32 C36,,,,,"PRESSE A COMPRESSIONE E TRANSFER | MACCHINE A INIEZIONE PER GOMMA | MACCHINE PER PROTOTIPAZIONE RAPIDA / MANIFATTURA ADDITIVA / SINTERIZZAZIONE LASER | UNITÀ DI RISCALDAMENTO E RAFFREDDAMENTO PER STAMPI E FILIERE | ATTREZZATURE AUSILIARIE PER LA LAVORAZIONE DI  MATERIE PLASTICHE E GOMMA, ALTRE | AUTOMAZIONE, ROBOTICA E INFORMATICA | RICONDIZIONAMENTO DI MACCHINARI | FORNITORI DI MACCHINARI DI SECONDA MANO | INSTALLAZIONE E RIMOZIONE DI MACCHINARI | RICONDIZIONAMENTO DI ATTREZZATURE E COMPONENTI | PRESSE PER  MATERIE PLASTICHE E GOMMA | MACCHINE E ATTREZZATURE PER L'INDUSTRIA DELLE MATERIE PLASTICHE E DELLA GOMMA | MACCHINE A INIEZIONE PER  MATERIE PLASTICHE E GOMMA | MACCHINE TRASFORMATRICI PER  MATERIE PLASTICHE E GOMMA,ALTRE | ATTREZZATURE AUSILIARIE PER LA LAVORAZIONE DI  MATERIE PLASTI",
ASOLO POLIMERI,https://dp-plast.fieramilano.it/exhibitor/232,https://dp-plast.fieramilano.it/exhibitor/232,Via del Lavoro 17,31011,ASOLO,TV,Veneto,Italy,+39 0423 529508,commerciale@asolopolimeri.com,http://www.asolopolimeri.com,9,B86,,,,,"POLIAMMIDE 6 (PA 6) | COPOLIMERI DI POLIPROPILENE (PPCP) | OMOPOLIMERI DI POLIPROPILENE (PPHP) | POLIETILENE RIGENERATO (R PE) | POLIPROPILENE RIGENERATO (R PP) | POLISTIRENE (GPPS, HIPS, EPS) | ACRILONITRILE-BUTADIENE-STIRENE (ABS) | POLIAMMIDICHE | MATERIE PRIME, RIGENERATE E COMPOSITI | POLIOLEFINICHE | STIRENICHE E COPOLIMERI A BASE DI STIRENE",
FEBO,https://dp-plast.fieramilano.it/exhibitor/233,https://dp-plast.fieramilano.it/exhibitor/233,S.S. Lucchese 193,51034,SERRAVALLE PISTOIESE,PT,Toscana,Italy,+39 0573 91501,info@febo.it,http://www.febo.it,9,A25 B26,,,,,MACCHINE A INIEZIONE PER TERMOPLASTICI FINO A 250 KN DI FORZA DI CHIUSURA | ESSICCATORI/DEUMIDIFICATORI PER MATERIALI IN MASSA | POLIMETILMETACRILATO (PMMA) | POLIAMMIDE 6 (PA 6) | POLIAMMIDE 66 (PA 66) | POLIBUTILENTEREFTALATO (PBT) | POLIETILENTEREFTALATO RIGENERATO (R PET) | POLICARBONATO (PC) | POLIETILENTEREFTALATO (PET) | POLIETILENE BASSA DENSITA' (LDPE) | POLIETILENE LINEARE BASSA DENSITA' (LLDPE) | POLIETILENE ALTA DENSITA' (HDPE) | COPOLIMERI DI POLIPROPILENE (PPCP) | POLIETILENE MEDIA DENSITA' (MDPE) | POLIETILENE ALTO PESO MOLECOLARE (HMWPE) | OMOPOLIMERI DI POLIPROPILENE (PPHP) | POLIETILENE RIGENERATO (R PE) | POLIPROPILENE RIGENERATO (R PP) | COPOLIMERI DI STIRENE-ACRILONITRILE (SAN) | ACRILONITRILE-BUTADIENE-STIRENE (ABS) | ACRILONITRILE-STIRENE-ACRILATO (ASA) | POLIETERETE,
LEHVOSS ITALIA,https://dp-plast.fieramilano.it/exhibitor/234,https://dp-plast.fieramilano.it/exhibitor/234,Viale Italia 2,21040,ORIGGIO,VA,Lombardia,Italy,+39 02 96446411,info@lehvoss.it,http://www.lehvoss.it,9,D76 D78,,,,,"FENOLICHE | POLIBUTADIENE (PB) | POLICLOROPRENE (CR) | ELASTOMERI A BLOCCHI STIRENICI (SIS, SBS, SEBS) | STIRENE-BUTADIENE (SBR) | NITRILE-BUTADIENE (NBR) | ETILENE-PROPILENE (EPR, EPDM) | MASTERBATCH RITARDANTI DI FIAMMA | MASTERBATCH MODIFICANTI | ALTRI MASTERBATCH | VULCANIZZANTI | ESPANDENTI | ADESIVIZZANTI | ALTRI ADDITIVI E AUSILIARI | CARICHE E RIEMPITIVI MINERALI | RESINE TERMOINDURENTI | MATERIE PRIME, RIGENERATE E COMPOSITI | ELASTOMERI | PIGMENTI, COLORANTI E MASTERBATCH | ALTRI ADDITIVI E AUSILIARI DI PROCESSO | CARICHE E RINFORZI","LEHVOSS Italia è la filiale italiana di LEHVOSS Group, multinazionale operante nel settore chimico con sede ad Amburgo, Germania, che da oltre 125 anni si dedica alla vendita di specialità chimiche. Fondata nel 1990, LEHVOSS Italia distribuisce materie prime destinate a vari settori industriali. Nel settore della produzione di mescole in gomma, LEHVOSS offre le seguenti materie prime: gomme sintetiche (EP(D)M, NBR, SBR, SSBR, BR, HSR, CR, Denka ER/AEM), cariche rinforzanti (silice precipitata, carbon black, caolini, wollastonite, talchi micro e ultra-lamellari, ecc.), chemicals (acceleranti, aiuti di processo, antiossidanti, coagenti, silani, ecc.), ossidi di metallo (MgO/ZnO), agenti espandenti e diverse alternative sostenibili (silice da pula di riso, attivatori di vulcanizzazione, ecc)."
OCS,https://dp-plast.fieramilano.it/exhibitor/235,https://dp-plast.fieramilano.it/exhibitor/235,Via Soldini 10,24060,ADRARA SAN MARTINO,BG,Lombardia,Italy,+39 035 933487,info@ocs-stampi.it,http://www.ocs-stampi.it,11,C12,,,,,STAMPI PER INIEZIONE/COMPRESSIONE | STAMPI E FILIERE PER  MATERIE PLASTICHE E GOMMA | MACCHINE E ATTREZZATURE PER L'INDUSTRIA DELLE MATERIE PLASTICHE E DELLA GOMMA,Azienda produttrice di stampi a iniezione e compressione per articoli in gomma e silicone. Effettua anche servizio di cromatura stampi.
OMSO,https://dp-plast.fieramilano.it/exhibitor/236,https://dp-plast.fieramilano.it/exhibitor/236,Via Adige 11/E,42124,REGGIO EMILIA,RE,Emilia-Romagna,Italy,+39 0522 382696,info@omso.it,http://www.omso.it,22,A51,,,,,"MACCHINE PER STAMPA SU PRODOTTI IN PLASTICA E GOMMA | STAMPATRICI FLESSOGRAFICHE | STAMPATRICI OFFSET | STAMPATRICI SERIGRAFICHE | STAMPATRICI, ALTRE | MACCHINE E IMPIANTI PER FINITURA, DECORAZIONE, STAMPA E E MARCATURA DI PRODOTTI IN MATERIE PLASTICHE | MACCHINE E ATTREZZATURE PER L'INDUSTRIA DELLE MATERIE PLASTICHE E DELLA GOMMA",
CAMPETELLA,https://dp-plast.fieramilano.it/exhibitor/237,https://dp-plast.fieramilano.it/exhibitor/237,Via Grazia Deledda 40/42  Z.I. Villa Mattei,62010,MONTECASSIANO,MC,Marche,Italy,+39 0733 29891,commerciale@campetella.it,http://www.campetella.com,22,A41 A47,,,,,"PELLETTIZZATORI | AVVOLGITORI-BOBINATORI | ATTREZZATURE PER DECORAZIONE IN STAMPO (IMD) | ATTREZZATURE DI MANIPOLAZIONE PER CARICO/SCARICO DELLE MACCHINE | SEPARATORI DI MATEROZZE | AUTOMAZIONE, ROBOTICA E INFORMATICA | MACCHINE E ATTREZZATURE PER LA PREPARAZIONE E IL RICICLAGGIO DELLE MATERIE PLASTICHE E DELLA GOMMA | MACCHINE E ATTREZZATURE PER L'INDUSTRIA DELLE MATERIE PLASTICHE E DELLA GOMMA | MACCHINE PER LAVORAZIONE SECONDARIA DI  MATERIE PLASTICHE E GOMMA | MACCHINE E IMPIANTI PER FINITURA, DECORAZIONE, STAMPA E E MARCATURA DI PRODOTTI IN MATERIE PLASTICHE | ATTREZZATURE AUSILIARIE PER LA LAVORAZIONE DI  MATERIE PLASTICHE E GOMMA | FABBRICAZIONE E PROCESSO | SERVIZI DI CONSULENZA E ORGANIZZAZIONI PER IL SETTORE DELLE MATERIE PLASTICHE E DELLA GOMMA","Campetella Robotic Center è un’azienda italiana specializzata nella produzione e applicazione di robot industriali e sistemi di automazione per stampaggio ad iniezione delle materie plastiche. Dal 1897, ci occupiamo di software, installazione degli impianti, vendita e assistenza post-vendita del prodotto robot in tutto il mondo."
EXACT,https://dp-plast.fieramilano.it/exhibitor/238,https://dp-plast.fieramilano.it/exhibitor/238,Via Venezia 18,24040,ZINGONIA,BG,Lombardia,Italy,+39 035 883672,info@exact.it,http://www.exact.it,15,M49 N50,,,,,"ATTREZZATURE PER RIDUZIONE DIMENSIONALE (FRANTUMATORI, TRITURATORI, GRANULATORI) | PELLETTIZZATORI | IMPIANTI DI RICICLAGGIO | ATTREZZATURE PER LA PREPARAZIONE E IL RICICLAGGIO, ALTRE | ESTRUSORI MONOVITE | TAGLIERINE | ATTREZZATURE AUSILIARIE PER LA LAVORAZIONE DI  MATERIE PLASTICHE E GOMMA, ALTRE | ALTRI RINFORZI IN FIBRE | MACCHINE E ATTREZZATURE PER LA PREPARAZIONE E IL RICICLAGGIO DELLE MATERIE PLASTICHE E DELLA GOMMA | MACCHINE E ATTREZZATURE PER L'INDUSTRIA DELLE MATERIE PLASTICHE E DELLA GOMMA | ESTRUSORI E IMPIANTI D'ESTRUSIONE PER  MATERIE PLASTICHE E GOMMA | MACCHINE PER LAVORAZIONE SECONDARIA DI  MATERIE PLASTICHE E GOMMA | ATTREZZATURE AUSILIARIE PER LA LAVORAZIONE DI  MATERIE PLASTICHE E GOMMA | CARICHE E RINFORZI | MATERIE PRIME, RIGENERATE E COMPOSITI","EXACT, con sede a Zingonia, è leader nell'eccellenza meccanica per il recupero plastico dal 1974. Pioniere del settore, EXACT è l'inventore delle rivoluzionarie rigranulatrici a freddo, una tecnologia esclusiva che ha trasformato il processo di riciclo industriale. Le soluzioni di EXACT permettono il recupero immediato degli scarti di produzione, riducendo i consumi energetici e mantenendo intatte le proprietà del polimero. Innovazione, sostenibilità e Made in Italy al servizio dell'economia circolare."
MARFRAN,https://dp-plast.fieramilano.it/exhibitor/239,https://dp-plast.fieramilano.it/exhibitor/239,"Via Giulio Pastore 33/35, Nigoline",25040,CORTE FRANCA,BS,Lombardia,Italy,+39 030 9860511,info@marfran.com,http://www.marfran.com,9,B112,,,,,"ELASTOMERI A BLOCCHI STIRENICI (SIS, SBS, SEBS) | ELASTOMERI TERMOPLASTICI (TPE) | ALTRI ELASTOMERI | ELASTOMERI | MATERIE PRIME, RIGENERATE E COMPOSITI",
MAKLAUS,https://dp-plast.fieramilano.it/exhibitor/240,https://dp-plast.fieramilano.it/exhibitor/240,Località Piani Dell Rugginosa 236/237,50066,REGGELLO,FI,Toscana,Italy,+39 055 0456700,info@maklaus.com,http://www.maklaus.com,15,M67 N74,,,,,"AVVOLGITORI-BOBINATORI | TAGLIERINE RIBOBINATRICI | FUSTELLATRICI E PERFORATRICI | LINEE DI STIRAMENTO PER FILM, FILAMENTI ECC. | STAMPATRICI FLESSOGRAFICHE | MACCHINE PER LAVORAZIONE SECONDARIA DI  MATERIE PLASTICHE E GOMMA | MACCHINE E ATTREZZATURE PER L'INDUSTRIA DELLE MATERIE PLASTICHE E DELLA GOMMA | MACCHINE PER STAMPA SU PRODOTTI IN PLASTICA E GOMMA | MACCHINE E IMPIANTI PER FINITURA, DECORAZIONE, STAMPA E E MARCATURA DI PRODOTTI IN MATERIE PLASTICHE","Ribobinatori e Stampe flessografiche per film estensibile, Macroperforatori per materiale in movimento, impiegati nel settore industriale, agricolo e alimentare."
FRIGEL,https://dp-plast.fieramilano.it/exhibitor/241,https://dp-plast.fieramilano.it/exhibitor/241,Via Pisana 316,50018,SCANDICCI,FI,Toscana,Italy,+39 055 722091,marketing@frigel.com,http://www.frigel.com,24,C101 C105,,,,,UNITÀ DI RISCALDAMENTO E RAFFREDDAMENTO PER STAMPI E FILIERE | DISPOSITIVI PER IL CONTROLLO DI TEMPERATURA | ATTREZZATURE AUSILIARIE PER LA LAVORAZIONE DI  MATERIE PLASTICHE E GOMMA | MACCHINE E ATTREZZATURE PER L'INDUSTRIA DELLE MATERIE PLASTICHE E DELLA GOMMA | CONTROLLI DI PROCESSO,"Frigel, fondata nel 1960, è oggi un produttore globale di sistemi di raffreddamento e controllo della temperatura, ma anche il partner ideale, consulente tecnico, con la capacità di identificare la soluzione migliore in termini di prestazioni, efficienza e impatto ambientale."
G3 MIXING TECHNOLOGIES,https://dp-plast.fieramilano.it/exhibitor/242,https://dp-plast.fieramilano.it/exhibitor/242,"Via Bonifica Km 15,5",64010,ANCARANO,TE,Abruzzo,Italy,+39 0861 815113,sales@g3machinery.com,http://www.g3machinery.com,11,C31 C35,,,,,"MESCOLATORI A CILINDRI | ATTREZZATURE PER RIDUZIONE DIMENSIONALE (FRANTUMATORI, TRITURATORI, GRANULATORI) | IMPIANTI DI MESCOLAZIONE | IMPIANTI D'ESTRUSIONE PER FILM-FOGLIE-LASTRE | ESTRUSORI BIVITE | IMPIANTI D'ESTRUSIONE PER TUBI E PROFILI | IMPIANTI D'ESTRUSIONE PER GOMMA | IMPIANTI D'ESTRUSIONE PER COMPOUND | MACCHINE PER LA LAVORAZIONE DELLA GOMMA, ALTRE | TAGLIERINE | DISPOSITIVI E SISTEMI DI CONTROLLO E SUPERVISIONE, ALTRI | MISCELATORI DI TIPO CONTINUO PER SOLIDI | MISCELATORI DI TIPO CONTINUO PER LIQUIDI | MISCELATORI DI TIPO DISCONTINUO PER SOLIDI | MISCELATORI DI TIPO DISCONTINUO PER LIQUIDI | MACCHINE E ATTREZZATURE PER LA PREPARAZIONE E IL RICICLAGGIO DELLE MATERIE PLASTICHE E DELLA GOMMA | MACCHINE E ATTREZZATURE PER L'INDUSTRIA DELLE MATERIE PLASTICHE E DELLA GOMMA | ESTRUSO",
GEFIT,https://dp-plast.fieramilano.it/exhibitor/243,https://dp-plast.fieramilano.it/exhibitor/243,Strada Provinciale per Felizzano 245,15043,FUBINE MONFERRATO,AL,Piemonte,Italy,+39 0131 792822,mouldassembly@gefitmail.com,http://www.gefit.com,24,D12 D16,,,,,"STAMPI, ALTRI | STAMPI PER INIEZIONE/COMPRESSIONE | PROGETTAZIONE DEL PRODOTTO | RICERCA E SVILUPPO | STAMPI E FILIERE PER  MATERIE PLASTICHE E GOMMA | MACCHINE E ATTREZZATURE PER L'INDUSTRIA DELLE MATERIE PLASTICHE E DELLA GOMMA | SERVIZI DI CONSULENZA E ORGANIZZAZIONI PER IL SETTORE DELLE MATERIE PLASTICHE E DELLA GOMMA | FABBRICAZIONE E PROCESSO","La Divisione Moulds & Assembly progetta e realizza stampi ad inizione e macchine di assemblaggio ad alta velocità e precisione per la produzione di chiusure e di componenti in plastica.  Unico player a livello internazionale a offrire entrambe queste due tecnologie, si rivolge ai settori alimentari, cosmetico, detergenza, farmaceutico e medicale, affiancando i proprio clienti anche con attività di R&D, studio, prototipazione e sviluppo prodotto."
GRUNIVERPAL,https://dp-plast.fieramilano.it/exhibitor/244,https://dp-plast.fieramilano.it/exhibitor/244,Via Provinciale Verzuolo 2,12026,PIASCO,CN,Piemonte,Italy,+39 0175 79301,info@gruniverpal.it,http://www.gruniverpal.it,22,B56,,,,,"MACCHINE PER L'INDUSTRIA DEGLI PNEUMATICI | MACCHINE PER LA LAVORAZIONE DELLA GOMMA, ALTRE | STAMPI, ALTRI | ATTREZZATURE DI MANIPOLAZIONE PER CARICO/SCARICO DELLE MACCHINE | SISTEMI DI CAMBIO STAMPI | MAGAZZINI STAMPI | SISTEMI DI MOVIMENTAZIONE STAMPI | CARRELLI PER CAMBIO STAMPI | MACCHINE TRASFORMATRICI PER  MATERIE PLASTICHE E GOMMA,ALTRE | MACCHINE E ATTREZZATURE PER L'INDUSTRIA DELLE MATERIE PLASTICHE E DELLA GOMMA | STAMPI E FILIERE PER  MATERIE PLASTICHE E GOMMA | ATTREZZATURE AUSILIARIE PER LA LAVORAZIONE DI  MATERIE PLASTICHE E GOMMA",
KRAHN ITALIA,https://dp-plast.fieramilano.it/exhibitor/245,https://dp-plast.fieramilano.it/exhibitor/245,Via Santa Marta 23,20123,MILANO,MI,Lombardia,Italy,+39 02 725601,info.it@krahn.eu,http://www.krahn.eu/it/it,9,C05 D02,,,,,"CLORURO DI POLIVINILE (PVC) | PIGMENTI IN POLVERE | COLORANTI LIQUIDI | MASTERBATCH COLORANTI | MASTERBATCH RITARDANTI DI FIAMMA | STABILIZZANTI | PLASTIFICANTI | LUBRIFICANTI | ESPANDENTI | DISTACCANTI | ALTRI ADDITIVI E AUSILIARI | CARICHE E RIEMPITIVI MINERALI | VINILICHE | MATERIE PRIME, RIGENERATE E COMPOSITI | PIGMENTI, COLORANTI E MASTERBATCH | ALTRI ADDITIVI E AUSILIARI DI PROCESSO | CARICHE E RINFORZI","KRAHN Italia S.p.A. è una società che opera nella distribuzione di specialità chimiche, parte del Gruppo KRAHN Chemie, realtà internazionale con oltre 100 anni di esperienza nel settore. L’azienda opera come partner qualificato per l’industria, offrendo un portafoglio completo di prodotti ad alto valore aggiunto e un supporto tecnico dedicato. Attraverso collaborazioni consolidate con produttori globali e un laboratorio applicativo a Lainate, KRAHN Italia garantisce soluzioni affidabili, qualità costante e un approccio orientato alla sostenibilità e all’innovazione."
TOYO EUROPE,https://dp-plast.fieramilano.it/exhibitor/246,https://dp-plast.fieramilano.it/exhibitor/246,Via dell'Industria 14,25020,AZZANO MELLA,BS,Lombardia,Italy,+39 030 9747041,info@toyo-europe.com,http://www.toyo-europe.com,24,B121 C132,,,,,MACCHINE A INIEZIONE PER TERMOPLASTICI OLTRE 10000 KN DI FORZA DI CHIUSURA | MACCHINE A INIEZIONE PER MULTICOMPONENTI | MACCHINE A INIEZIONE PER TERMOPLASTICI FINO A 250 KN DI FORZA DI CHIUSURA | MACCHINE A INIEZIONE PER TERMOPLASTICI DA 4000 KN FINO A 10000 KN DI FORZA DI CHIUSURA | MACCHINE A INIEZIONE PER TERMOPLASTICI DA 1000 KN FINO A 4000 KN DI FORZA DI CHIUSURA | MACCHINE A INIEZIONE PER  MATERIE PLASTICHE E GOMMA | MACCHINE E ATTREZZATURE PER L'INDUSTRIA DELLE MATERIE PLASTICHE E DELLA GOMMA,"MACCHINE A INIEZIONE PER LO STAMPAGGIO DI PRODOTTI TERMOPLASTICI DA 50 a 1300 ton, COMPLETAMENTE ELETTRICHE"
WITTMANN BATTENFELD,https://dp-plast.fieramilano.it/exhibitor/247,https://dp-plast.fieramilano.it/exhibitor/247,"Via Giuseppe Mazzini, 180/A",20816,CERIANO LAGHETTO,MB,Lombardia,Italy,+39 02 96981020,info@wittmann-group.it,http://www.wittmann-group.com,22,B121 B125,,,,,"ATTREZZATURE PER RIDUZIONE DIMENSIONALE (FRANTUMATORI, TRITURATORI, GRANULATORI) | PRESSE A COMPRESSIONE E TRANSFER | MACCHINE A INIEZIONE PER TERMOPLASTICI OLTRE 10000 KN DI FORZA DI CHIUSURA | MACCHINE A INIEZIONE PER MULTICOMPONENTI | MACCHINE A INIEZIONE MULTISTAZIONE | MACCHINE A INIEZIONE PER TERMOPLASTICI FINO A 250 KN DI FORZA DI CHIUSURA | MACCHINE A INIEZIONE PER TERMOPLASTICI DA 4000 KN FINO A 10000 KN DI FORZA DI CHIUSURA | MACCHINE A INIEZIONE PER TERMOPLASTICI DA 250 KN FINO A 1000 KN DI FORZA DI CHIUSURA | MACCHINE A INIEZIONE PER TERMOPLASTICI DA 1000 KN FINO A 4000 KN DI FORZA DI CHIUSURA | MACCHINE A INIEZIONE PER TERMOINDURENTI | DOSATORI E MISCELATORI | ATTREZZATURE DI DOSAGGIO | CONVOGLIATORI E SISTEMI DI TRASPORTO DI POLVERI E GRANULI (ESCLUSI CARRELLI E CARRELLI ELEV","Il Gruppo WITTMANN è leader mondiale nella produzione di presse per lo stampaggio a iniezione, manipolatori ed attrezzature ausiliarie per la lavorazione di una grande varietà di materiali plastificabili (plastiche tradizionali, bio-plastiche, silicone liquido, etc.). Seguendo i principi della protezione dell'ambiente, della conservazione delle risorse e dell'economia circolare, il Gruppo WITTMANN da sempre si impegna nello sviluppo di tecnologie di processo all'avanguardia per ottenere la massima efficienza energetica nello stampaggio ad iniezione e, più in generale, nella lavorazione di materiali standard e materiali ad alto contenuto di riciclati, così come di materie prime rinnovabili. I prodotti del Gruppo WITTMANN sono progettati per la loro integrazione orizzontale e verticale all’interno di una Smart Factory e possono essere interconnessi tra loro per costituire una cella di produzione “smart”. Il Gruppo ha sede a Vienna ed è composto da due divisioni principali: WITTMANN e WITTMANN BATTENFELD. Le società del gruppo gestiscono congiuntamente 10 stabilimenti produttivi dislocati in 6 nazioni, con filiali di vendita presenti in tutti i principali mercati industriali del mondo. WITTMANN persegue un'ulteriore espansione della sua posizione di mercato in qualità di costruttore di presse per lo stampaggio ad iniezione e fornitore di una moderna e completa gamma di macchinari dal design modulare. La gamma di prodotti WITTMANN comprende robot e sistemi di automazione, sistemi"
IMG,https://dp-plast.fieramilano.it/exhibitor/248,https://dp-plast.fieramilano.it/exhibitor/248,Via Industriale 108,25020,CAPRIANO DEL COLLE,BS,Lombardia,Italy,+39 030 314645,info@imgmacchine.it,http://www.imgmacchine.it,11,A41 A45,,,,,PRESSE A COMPRESSIONE E TRANSFER | MACCHINE A INIEZIONE PER GOMMA | MACCHINE A INIEZIONE PER TERMOPLASTICI DA 250 KN FINO A 1000 KN DI FORZA DI CHIUSURA | PRESSE PER  MATERIE PLASTICHE E GOMMA | MACCHINE E ATTREZZATURE PER L'INDUSTRIA DELLE MATERIE PLASTICHE E DELLA GOMMA | MACCHINE A INIEZIONE PER  MATERIE PLASTICHE E GOMMA,"Azienda italiana leader nelle produzione di presse Orizzontali e Verticali ad iniezione e compressione per la produzione di articoli in gomma, silicone solido e liquido (LSR) e materiale termoindurente.
 Grazie alle notre partnership offriamo pachetti completi per offrire ai clienti delle soluzioni chiavi in mano: pressa completa di relativo stampo ed eventuale cella robotica con robot per rimozione dei pezzi in modo automatico.
 Un ampio servizio after sales con assistenza da remoto, in loco grazie ai nostri tecnici e corsi di formazioni per i nostri clienti completano la nostra offerta di non semplici fornitori di presse, ma di soluzioni nel mondo della gomma a 360°. 
 Siamo inoltre presenti in 13 paesi EU ed extra EU e la nostra rete agenti comprende 11 agenzie di rappresentanza. 
 www.imgmacchine.it"
LATI,https://dp-plast.fieramilano.it/exhibitor/249,https://dp-plast.fieramilano.it/exhibitor/249,Via Francesco Baracca,21040,VEDANO OLONA,VA,Lombardia,Italy,+39 0332 409111,marketing@it.lati.com,http://www.lati.com,9,B66 B70,,,,,"POLIAMMIDE 6 (PA 6) | POLIAMMIDE 66 (PA 66) | POLIAMMIDE 12 (PA 12) | COPOLIMERI | POLIBUTILENTEREFTALATO (PBT) | POLICARBONATO (PC) | COPOLIMERI DI POLIPROPILENE (PPCP) | OMOPOLIMERI DI POLIPROPILENE (PPHP) | ACRILONITRILE-BUTADIENE-STIRENE (ABS) | POLIETERETERCHETONE (PEEK) | POLIFENILENSOLFURO (PPS) | ACETALICHE (POM) | POLISULFONE (PSU) | POLIETERSULFONE (PES) | BIOPOLIMERI | ALTRE RESINE | POLIAMMIDICHE | MATERIE PRIME, RIGENERATE E COMPOSITI | POLIESTERI TERMOPLASTICI | POLIOLEFINICHE | STIRENICHE E COPOLIMERI A BASE DI STIRENE | ALTRE MATERIE PLASTICHE | RESINE TERMOINDURENTI",
MAICOPRESSE,https://dp-plast.fieramilano.it/exhibitor/250,https://dp-plast.fieramilano.it/exhibitor/250,Via Garza 28,25010,BORGOSATOLLO,BS,Lombardia,Italy,+39 030 2500211,info@maicopresse.com,http://www.maicopresse.com,24,C21 D26,,,,,"MACCHINE A INIEZIONE PER TERMOPLASTICI OLTRE 10000 KN DI FORZA DI CHIUSURA | MACCHINE A INIEZIONE PER MULTICOMPONENTI | MACCHINE A INIEZIONE PER TERMOPLASTICI DA 4000 KN FINO A 10000 KN DI FORZA DI CHIUSURA | MACCHINE A INIEZIONE PER TERMOPLASTICI DA 1000 KN FINO A 4000 KN DI FORZA DI CHIUSURA | STAMPI PER INIEZIONE/COMPRESSIONE | SISTEMI DI BLOCCAGGIO STAMPI E ALLACCIAMENTI DI POTENZA | VITI DI PLASTIFICAZIONE | CILINDRI DI PLASTIFICAZIONE | CAMERE DI PLASTIFICAZIONE | UGELLI | ELEMENTI RISCALDANTI PER CAMERE E CILINDRI DI PLASTIFICAZIONE / RESISTENZE / IRRADIATORI | PARTI E COMPONENTI DI MACCHINE PER MATERIE PLASTICHE E GOMMA, ALTRE | AUTOMAZIONE, ROBOTICA E INFORMATICA | RICONDIZIONAMENTO DI MACCHINARI | MACCHINE A INIEZIONE PER  MATERIE PLASTICHE E GOMMA | MACCHINE E ATTREZZATURE PER L","Produzione di macchine ad iniezione per lo stampaggio di materie plastiche, sistemi di automazione completi, robot cartesiani e antropomorfi, sistemi IML, mani di presa, impianti robotizzati dedicati"
